budget,genres,id,keywords,original_title,overview,popularity,production_companies,production_countries,release_date,revenue,runtime,title,vote_average,vote_count,Unnamed: 0,year,synopsis,critic_score,people_score,total_reviews,total_ratings,type,genre,box_office_(gross_usa),crew
55000000,"[{""id"": 10751, ""name"": ""Family""}, {""id"": 35, ""name"": ""Comedy""}]",116149,"[{""id"": 392, ""name"": ""england""}, {""id"": 477, ""name"": ""train station""}, {""id"": 818, ""name"": ""based on novel""}, {""id"": 10468, ""name"": ""bear""}, {""id"": 11500, ""name"": ""anthropomorphism""}, {""id"": 167625, ""name"": ""talking to animals""}, {""id"": 170173, ""name"": ""children's book""}]",Paddington,"A young Peruvian bear with a passion for all things British travels to London in search of a home. Finding himself lost and alone at Paddington Station, he begins to realize that city life is not all he had imagined - until he meets the kindly Brown family, who read the label around his neck ('Please look after this bear. Thank you.') and offer him a temporary haven. It looks as though his luck has changed until this rarest of bears catches the eye of a museum taxidermist...",39.882276,"[{""name"": ""The Weinstein Company"", ""id"": 308}, {""name"": ""StudioCanal"", ""id"": 694}, {""name"": ""TF1 Films Production"", ""id"": 3823}, {""name"": ""Canal+"", ""id"": 5358}, {""name"": ""Heyday Films"", ""id"": 7364}, {""name"": ""Cin\u00e9+"", ""id"": 10611}, {""name"": ""Anton Capital Entertainment (ACE)"", ""id"": 20664}, {""name"": ""TF1"", ""id"": 22123}, {""name"": ""Amazon Prime Instant Video"", ""id"": 58773}]","[{""iso_3166_1"": ""GB"", ""name"": ""United Kingdom""}]",2014-11-27,259207227,95.0,Paddington,7.0,883,472,2014,"After a deadly earthquake destroys his home in Peruvian rainforest, a young bear (Ben Whishaw) makes his way to England in search of a new home. The bear, dubbed ""Paddington"" for the london train station, finds shelter with the family of Henry (Hugh Bonneville) and Mary Brown (Sally Hawkins). Although Paddington's amazement at urban living soon endears him to the Browns, someone else has her eye on him: Taxidermist Millicent Clyde (Nicole Kidman) has designs on the rare bear and his hide.",97,80.0,163,"50,000+",Comedy,"kids and family, comedy, adventure",,"Hugh Bonneville, Sally Hawkins, Julie Walters, Jim Broadbent, Peter Capaldi, Nicole Kidman, Madeleine Harris, Samuel Joslin, Ben Whishaw, Imelda Staunton, David Heyman, Erik Wilson, Gary Williamson, Justin Brown"
0,"[{""id"": 35, ""name"": ""Comedy""}]",10393,"[{""id"": 579, ""name"": ""american football""}, {""id"": 4112, ""name"": ""strike""}, {""id"": 6075, ""name"": ""sport""}, {""id"": 8338, ""name"": ""coach""}, {""id"": 9789, ""name"": ""misfit""}, {""id"": 155791, ""name"": ""american football player""}]",The Replacements,"Maverick old-guard coach Jimmy McGinty is hired in the wake of a players' strike to help the Washington Sentinels advance to the playoffs. But that impossible dream hinges on whether his replacements can hunker down and do the job. So, McGinty dusts off his secret dossier of ex-players who never got a chance (or screwed up the one they were given) and knits together a bad-dream team of guys who just may give the Sentinels their title shot.",14.837288,"[{""name"": ""Warner Bros."", ""id"": 6194}]","[{""iso_3166_1"": ""US"", ""name"": ""United States of America""}]",2000-08-07,0,118.0,The Replacements,6.1,203,1463,2000,"It's late in the season; the playoffs are fast approaching; and the Washington Sentinels have just gone on strike. Scrambling for a solution, the Sentinels' owner Edward O'Neil hatches a plan to bring in legendary coach Jimmy McGinty to recruit a team of replacement players in exactly one week. For fans and owners alike, the strike is a disaster. But for Shane Falco and a mismatched crew of outsiders, it is the second chance they've waited their whole lives for.",41,66.0,108,"100,000+",Sports & Fitness,comedy,$44.7M,"Keanu Reeves, Gene Hackman, Orlando Jones, Jon Favreau, Brooke Langton, Rhys Ifans, Jack Warden, Faizon Love, Michael Taliferro, Ace Yonamine, Howard Deutch, Vince McKewin, Jeffrey Chernov, Steven Reuther, Erwin Stoff, John Debney, Tak Fujimoto, Seth Flaum, Bud S. Smith, Dan Bishop"
70000000,"[{""id"": 12, ""name"": ""Adventure""}, {""id"": 16, ""name"": ""Animation""}, {""id"": 10751, ""name"": ""Family""}, {""id"": 14, ""name"": ""Fantasy""}, {""id"": 878, ""name"": ""Science Fiction""}]",10386,"[{""id"": 2106, ""name"": ""cold war""}, {""id"": 6054, ""name"": ""friendship""}, {""id"": 10891, ""name"": ""giant robot""}, {""id"": 167310, ""name"": ""sitting on a toilet""}, {""id"": 205726, ""name"": ""fear of unknown""}, {""id"": 208611, ""name"": ""1950s""}, {""id"": 215404, ""name"": ""laxative""}]",The Iron Giant,"In the small town of Rockwell, Maine in October 1957, a giant metal machine befriends a nine-year-old boy and ultimately finds its humanity by unselfishly saving people from their own fears and prejudices.",61.245957,"[{""name"": ""Warner Bros. Animation"", ""id"": 2785}]","[{""iso_3166_1"": ""US"", ""name"": ""United States of America""}]",1999-08-06,23159305,86.0,The Iron Giant,7.6,1436,139,1999,"In this animated adaptation of Ted Hughes' Cold War fable, a giant alien robot (Vin Diesel) crash-lands near the small town of Rockwell, Maine, in 1957. Exploring the area, a local 9-year-old boy, Hogarth, discovers the robot, and soon forms an unlikely friendship with him. When a paranoid government agent, Kent Mansley, becomes determined to destroy the robot, Hogarth and beatnik Dean McCoppin (Harry Connick Jr.) must do what they can to save the misunderstood machine.",96,90.0,143,"100,000+",Animation,"kids and family, animation, adventure, fantasy",,"Jennifer Aniston, Eli Marienthal, Harry Connick Jr., Vin Diesel, Christopher McDonald, James Gammon, Cloris Leachman, John Mahoney, M. Emmet Walsh, Brad Bird, Brad Bird, Tim McCanlies, Pete Townshend, Des McAnuff, Allison Abbate, Michael Kamen, Darren T. Holmes"
44500000,"[{""id"": 18, ""name"": ""Drama""}, {""id"": 53, ""name"": ""Thriller""}]",68734,"[{""id"": 591, ""name"": ""cia""}, {""id"": 1157, ""name"": ""wife husband relationship""}, {""id"": 1937, ""name"": ""document""}, {""id"": 2020, ""name"": ""revolution""}, {""id"": 2430, ""name"": ""hiding place""}, {""id"": 2519, ""name"": ""canadian""}, {""id"": 2562, ""name"": ""press conference""}, {""id"": 5565, ""name"": ""biography""}, {""id"": 15292, ""name"": ""hanged man""}, {""id"": 34061, ""name"": ""american abroad""}, {""id"": 159306, ""name"": ""crane""}, {""id"": 159514, ""name"": ""subtitled scene""}, {""id"": 161996, ""name"": ""movie poster""}, {""id"": 165340, ""name"": ""based on article""}, {""id"": 185677, ""name"": ""extraction""}, {""id"": 185684, ""name"": ""iran hostage crisis""}, {""id"": 185686, ""name"": ""sweatshop""}, {""id"": 185692, ""name"": ""intelligence agent""}, {""id"": 185699, ""name"": ""film studio""}, {""id"": 185702, ""name"": ""langley virginia""}, {""id"": 208289, ""name"": ""1980s""}]",Argo,"As the Iranian revolution reaches a boiling point, a CIA 'exfiltration' specialist concocts a risky plan to free six Americans who have found shelter at the home of the Canadian ambassador.",62.01056,"[{""name"": ""GK Films"", ""id"": 3281}, {""name"": ""Warner Bros."", ""id"": 6194}, {""name"": ""Smokehouse Pictures"", ""id"": 22695}]","[{""iso_3166_1"": ""US"", ""name"": ""United States of America""}]",2012-10-11,232324128,120.0,Argo,7.1,3423,637,2012,"On Nov. 4, 1979, militants storm the U.S. embassy in Tehran, Iran, taking 66 American hostages. Amid the chaos, six Americans manage to slip away and find refuge with the Canadian ambassador. Knowing that it's just a matter of time before the refugees are found and likely executed, the U.S. government calls on extractor Tony Mendez (Ben Affleck) to rescue them. Mendez's plan is to pose as a Hollywood producer scouting locations in Iran and train the refugees to act as his ""film"" crew.",96,90.0,358,"100,000+",Drama,"mystery and thriller, drama, history",$136.0M,"Ben Affleck, Bryan Cranston, Alan Arkin, John Goodman, Victor Garber, Tate Donovan, Clea DuVall, Scoot McNairy, Rory Cochrane, Christopher Denham, Ben Affleck, Chris Terrio, Grant Heslov, Ben Affleck, George Clooney, David Klawans, Nina Wolarsky, Chris Brigham, Chay Carter, Graham King"
60000000,"[{""id"": 28, ""name"": ""Action""}, {""id"": 80, ""name"": ""Crime""}, {""id"": 53, ""name"": ""Thriller""}]",2749,"[{""id"": 242, ""name"": ""new york""}, {""id"": 293, ""name"": ""female nudity""}, {""id"": 378, ""name"": ""prison""}, {""id"": 549, ""name"": ""prostitute""}, {""id"": 570, ""name"": ""rape""}, {""id"": 642, ""name"": ""robbery""}, {""id"": 657, ""name"": ""fire""}, {""id"": 703, ""name"": ""detective""}, {""id"": 822, ""name"": ""airport""}, {""id"": 1366, ""name"": ""shotgun""}, {""id"": 1563, ""name"": ""prisoner""}, {""id"": 1591, ""name"": ""ex-detainee""}, {""id"": 2013, ""name"": ""attempted murder""}, {""id"": 2340, ""name"": ""paranoia""}, {""id"": 2808, ""name"": ""russian""}, {""id"": 3023, ""name"": ""eastern europe""}, {""id"": 4697, ""name"": ""video""}, {""id"": 4728, ""name"": ""knife""}, {""id"": 5572, ""name"": ""fistfight""}, {""id"": 6149, ""name"": ""police""}, {""id"": 9727, ""name"": ""thief""}, {""id"": 9748, ""name"": ""revenge""}, {""id"": 10561, ""name"": ""video camera""}, {""id"": 10685, ""name"": ""escape""}, {""id"": 10688, ""name"": ""breast""}, {""id"": 10877, ""name"": ""dead body""}, {""id"": 10909, ""name"": ""lawyer""}, {""id"": 11325, ""name"": ""shot to death""}, {""id"": 13006, ""name"": ""torture""}, {""id"": 13073, ""name"": ""fear""}, {""id"": 14512, ""name"": ""new york city""}, {""id"": 14778, ""name"": ""urination""}, {""id"": 14819, ""name"": ""violence""}, {""id"": 14903, ""name"": ""home invasion""}, {""id"": 15009, ""name"": ""criminal""}, {""id"": 15167, ""name"": ""police detective""}, {""id"": 34079, ""name"": ""death""}, {""id"": 40879, ""name"": ""drunk""}, {""id"": 156022, ""name"": ""nypd""}, {""id"": 162502, ""name"": ""news report""}, {""id"": 163656, ""name"": ""gun violence""}, {""id"": 166512, ""name"": ""graveyard""}, {""id"": 211703, ""name"": ""death of boyfriend""}]",15 Minutes,"When Eastern European criminals Oleg and Emil come to New York City to pick up their share of a heist score, Oleg steals a video camera and starts filming their activities, both legal and illegal. When they learn how the American media circus can make a remorseless killer look like the victim and make them rich, they target media-savvy NYPD Homicide Detective Eddie Flemming and media-naive FDNY Fire Marshal Jordy Warsaw, the cops investigating their murder and torching of their former criminal partner, filming everything to sell to the local tabloid TV show ""Top Story.""",15.205371,"[{""name"": ""New Line Cinema"", ""id"": 12}, {""name"": ""Industry Entertainment"", ""id"": 376}, {""name"": ""Tribeca Productions"", ""id"": 11391}, {""name"": ""New Redemption Pictures"", ""id"": 67171}]","[{""iso_3166_1"": ""DE"", ""name"": ""Germany""}, {""iso_3166_1"": ""US"", ""name"": ""United States of America""}]",2001-03-01,56359980,120.0,15 Minutes,5.7,191,1521,2001,"At the center of ""15 Minutes"" is a New York City double murder that must be solved. But the fast-paced story isn't so much about figuring out the truth of the murder, as following who controls that truth. This is the thriller as seen through an eye-popping new lens -- that of the media's hunt for shocking imagery, no matter the cost. In ""15 Minutes,"" as the cops chase the murderers, the media chases the cops, and the whole thing fuels an escalating firestorm.",32,37.0,125,"50,000+",Television,mystery and thriller,$24.4M,"Robert De Niro, Edward Burns, Kelsey Grammer, Avery Brooks, Melina Kanakaredes, Karel Roden, Oleg Taktarov, Vera Farmiga, John DiResta, James Handy, John Herzfeld, John Herzfeld, Nick Wechsler, Keith Addis, David Blocker, John Herzfeld, Claire Rudnick Polstein, Mayne Schuyler Berke, Steven Cohen"
42000000,"[{""id"": 12, ""name"": ""Adventure""}, {""id"": 14, ""name"": ""Fantasy""}, {""id"": 28, ""name"": ""Action""}, {""id"": 37, ""name"": ""Western""}, {""id"": 53, ""name"": ""Thriller""}]",46528,"[{""id"": 782, ""name"": ""assassin""}, {""id"": 1415, ""name"": ""small town""}, {""id"": 5774, ""name"": ""forest""}, {""id"": 9748, ""name"": ""revenge""}, {""id"": 9758, ""name"": ""deception""}, {""id"": 11058, ""name"": ""super speed""}, {""id"": 11541, ""name"": ""surprise ending""}]",The Warrior's Way,"An Asian assassin (Dong-gun Jang) is forced to hide in a small town in the American Badlands. Also starring Kate Bosworth, Danny Huston, Tony Cox and Academy Award winner Geoffrey Rush.",7.349497,"[{""name"": ""Boram Entertainment Inc."", ""id"": 2965}]","[{""iso_3166_1"": ""NZ"", ""name"": ""New Zealand""}, {""iso_3166_1"": ""KR"", ""name"": ""South Korea""}]",2010-12-02,11087569,100.0,The Warrior's Way,6.3,136,1602,2010,"Refusing to kill an infant from an enemy clan, master swordsman Yang (Jang Dong Gun) takes the child and flees to an American frontier town. He puts away his sword for good, vowing to raise the baby in peace. Yang befriends Lynne, a woman who wants revenge against a colonel, the man who murdered her family. When the colonel returns to wreak havoc on the town, Yang draws his sword to protect his new friends, but the sound of fighting draws Yang's murderous clansmen into the fray as well.",31,47.0,42,"25,000+",Western,"western, action, fantasy, sports and fitness",$5.7M,"Jang Dong Gun, Geoffrey Rush, Kate Bosworth, Danny Huston, Tony Cox, Ti Lung, Sngmoo Lee, Sngmoo Lee, Barrie M. Osborne, Michael Peyser, Tim White, Eui Hong, Seung Jae Tcha, Nansun Shi, Satoru Iseki"
40000000,"[{""id"": 18, ""name"": ""Drama""}]",37799,"[{""id"": 2157, ""name"": ""hacker""}, {""id"": 12361, ""name"": ""hacking""}, {""id"": 162749, ""name"": ""creator""}, {""id"": 170209, ""name"": ""frat party""}, {""id"": 171063, ""name"": ""social network""}, {""id"": 171065, ""name"": ""deposition""}, {""id"": 171067, ""name"": ""intellectual property""}, {""id"": 171068, ""name"": ""entrepreneur""}, {""id"": 171070, ""name"": ""arrogance""}, {""id"": 220076, ""name"": ""young entrepreneur""}, {""id"": 220831, ""name"": ""facebook""}]",The Social Network,"On a fall night in 2003, Harvard undergrad and computer programming genius Mark Zuckerberg sits down at his computer and heatedly begins working on a new idea. In a fury of blogging and programming, what begins in his dorm room as a small site among friends soon becomes a global social network and a revolution in communication. A mere six years and 500 million friends later, Mark Zuckerberg is the youngest billionaire in history... but for this entrepreneur, success leads to both personal and legal complications.",69.27822,"[{""name"": ""Columbia Pictures"", ""id"": 5}, {""name"": ""Scott Rudin Productions"", ""id"": 258}, {""name"": ""Relativity Media"", ""id"": 7295}]","[{""iso_3166_1"": ""US"", ""name"": ""United States of America""}]",2010-09-30,224920315,120.0,The Social Network,7.1,3391,694,2010,"In 2003, Harvard undergrad and computer genius Mark Zuckerberg (Jesse Eisenberg) begins work on a new concept that eventually turns into the global social network known as Facebook. Six years later, he is one of the youngest billionaires ever, but Zuckerberg finds that his unprecedented success leads to both personal and legal complications when he ends up on the receiving end of two lawsuits, one involving his former friend (Andrew Garfield). Based on the book ""The Accidental Billionaires.""",96,86.0,326,"100,000+",Drama,"drama, biography",$96.9M,"Jesse Eisenberg, Andrew Garfield, Justin Timberlake, Armie Hammer, Max Minghella, Josh Pence, Brenda Song, Rashida Jones, John Getz, David Selby, David Fincher, Aaron Sorkin, Scott Rudin, Dana Brunetti, Michael De Luca, Ceán Chaffin, Kevin Spacey, Jeff Cronenweth, Donald Graham Burt, Angus Wall"
40000000,"[{""id"": 53, ""name"": ""Thriller""}, {""id"": 18, ""name"": ""Drama""}]",296098,"[{""id"": 470, ""name"": ""spy""}, {""id"": 591, ""name"": ""cia""}, {""id"": 2106, ""name"": ""cold war""}, {""id"": 2111, ""name"": ""soviet union""}, {""id"": 3203, ""name"": ""pilot""}, {""id"": 10909, ""name"": ""lawyer""}, {""id"": 14638, ""name"": ""american""}]",Bridge of Spies,"During the Cold War, the Soviet Union captures U.S. pilot Francis Gary Powers after shooting down his U-2 spy plane. Sentenced to 10 years in prison, Powers' only hope is New York lawyer James Donovan, recruited by a CIA operative to negotiate his release. Donovan boards a plane to Berlin, hoping to win the young man's freedom through a prisoner exchange. If all goes well, the Russians would get Rudolf Abel, the convicted spy who Donovan defended in court.",48.445978,"[{""name"": ""DreamWorks SKG"", ""id"": 27}, {""name"": ""Amblin Entertainment"", ""id"": 56}, {""name"": ""Studio Babelsberg"", ""id"": 264}, {""name"": ""Fox 2000 Pictures"", ""id"": 711}, {""name"": ""Marc Platt Productions"", ""id"": 2527}, {""name"": ""Participant Media"", ""id"": 6735}, {""name"": ""Reliance Entertainment"", ""id"": 7294}, {""name"": ""TSG Entertainment"", ""id"": 22213}]","[{""iso_3166_1"": ""IN"", ""name"": ""India""}, {""iso_3166_1"": ""US"", ""name"": ""United States of America""}, {""iso_3166_1"": ""DE"", ""name"": ""Germany""}]",2015-10-15,165478348,141.0,Bridge of Spies,7.2,2583,1089,2015,"During the Cold War, the Soviet Union captures U.S. pilot Francis Gary Powers after shooting down his U-2 spy plane. Sentenced to 10 years in prison, Powers' only hope is New York lawyer James Donovan (Tom Hanks), recruited by a CIA operative to negotiate his release. Donovan boards a plane to Berlin, hoping to win the young man's freedom through a prisoner exchange. If all goes well, the Russians would get Rudolf Abel (Mark Rylance), the convicted spy who Donovan defended in court.",90,87.0,309,"50,000+",Mystery & Suspense,"mystery and thriller, drama, history",$72.3M,"Tom Hanks, Mark Rylance, Alan Alda, Amy Ryan, Eve Hewson, Peter McRobbie, Billy Magnussen, Austin Stowell, Domenick Lombardozzi, Michael Gaston, Steven Spielberg, Matt Charman, Ethan Coen, Joel Coen, Steven Spielberg, Marc Platt, Kristie Macosko Krieger, Adam Somner, Daniel Lupi, Jeff Skoll"
39000000,"[{""id"": 16, ""name"": ""Animation""}, {""id"": 35, ""name"": ""Comedy""}, {""id"": 10751, ""name"": ""Family""}]",62214,"[{""id"": 367, ""name"": ""shyness""}, {""id"": 10121, ""name"": ""stop motion""}, {""id"": 12999, ""name"": ""black and white""}, {""id"": 13038, ""name"": ""retro""}, {""id"": 15162, ""name"": ""dog""}, {""id"": 157164, ""name"": ""animal death""}, {""id"": 158395, ""name"": ""animal lover""}]",Frankenweenie,"When a car hits young Victor's pet dog Sparky, Victor decides to bring him back to life the only way he knows how. But when the bolt-necked ""monster"" wreaks havoc and terror in the hearts of Victor's neighbors, he has to convince them that Sparky's still the good, loyal friend he was.",27.908783,"[{""name"": ""Tim Burton Productions"", ""id"": 8601}]","[{""iso_3166_1"": ""US"", ""name"": ""United States of America""}]",2012-10-04,35287788,87.0,Frankenweenie,6.6,932,183,2012,"Young Victor Frankenstein (Charlie Tahan) is a science nerd and outsider at school, but he does have one good friend: his dog, Sparky. But then, tragedy strikes, and Sparky shuffles off this mortal coil. Victor is heartbroken, but his science teacher (Martin Landau) gives him an idea of how to jolt old Sparky back to life. The experiment is successful, and all goes well, until Victor's fellow students steal his secret and use it to resurrect other dead animals -- with monstrous consequences.",87,70.0,222,"50,000+",Animation,"kids and family, comedy, animation",,"Catherine O'Hara, Martin Short, Martin Landau, Charlie Tahan, Atticus Shaffer, Winona Ryder, Robert Capron, Conchata Ferrell, James Hiroyuki Liao, Tom Kenny, Tim Burton, John August, Tim Burton, Allison Abbate, Don Hahn, Peter Sorg, Chris Lebenzon, Danny Elfman, Rick Heinrichs"
40000000,"[{""id"": 35, ""name"": ""Comedy""}]",64807,"[{""id"": 494, ""name"": ""father son relationship""}, {""id"": 6075, ""name"": ""sport""}, {""id"": 9823, ""name"": ""rivalry""}, {""id"": 172971, ""name"": ""elderly""}, {""id"": 218099, ""name"": ""elderly man""}]",Grudge Match,A pair of aging boxing rivals are coaxed out of retirement to fight one final bout -- 30 years after their last match.,21.362949,"[{""name"": ""Gerber Pictures"", ""id"": 975}, {""name"": ""Warner Bros."", ""id"": 6194}]","[{""iso_3166_1"": ""US"", ""name"": ""United States of America""}]",2013-12-25,44907260,113.0,Grudge Match,6.0,433,1466,2013,"Pittsburgh boxers Billy ""The Kid"" McDonnen (Robert De Niro) and Henry ""Razor"" Sharp (Sylvester Stallone) shared a fierce rivalry back in the 1980s. Each had scored a victory in two matches, but on the eve of their decisive third bout, Henry suddenly announced his retirement, effectively ending both boxers' careers. Thirty years later, boxing promoter Dante Slate Jr. (Kevin Hart) makes Billy and Henry an offer they can't refuse: Return to the ring and settle the score once and for all.",31,46.0,144,"25,000+",Sports & Fitness,comedy,$29.8M,"Robert De Niro, Sylvester Stallone, Kevin Hart, Kim Basinger, Alan Arkin, Jon Bernthal, Camden Gray, LL Cool J, Carrie Lazar, Todd Truley, Peter Segal, Rodney Rothman, Bill Gerber, Mark Steven Johnson, Michael Ewing, Peter Segal, Jane Rosenthal, Kevin King Templeton"
50000000,"[{""id"": 18, ""name"": ""Drama""}]",10400,"[{""id"": 378, ""name"": ""prison""}, {""id"": 2792, ""name"": ""boxer""}, {""id"": 4487, ""name"": ""boxing match""}, {""id"": 5402, ""name"": ""boxing school""}, {""id"": 5565, ""name"": ""biography""}]",The Hurricane,"The story of Rubin ""Hurricane"" Carter, a boxer wrongly imprisoned for murder, and the people who aided in his fight to prove his innocence.",20.825781,"[{""name"": ""Universal Pictures"", ""id"": 33}, {""name"": ""Beacon Communications"", ""id"": 919}, {""name"": ""Azoff Entertainment"", ""id"": 10619}]","[{""iso_3166_1"": ""US"", ""name"": ""United States of America""}]",1999-09-17,73956241,146.0,The Hurricane,7.2,396,1430,1999,"Denzel Washington is Rubin ""Hurricane"" Carter, a man whose dreams of winning the middleweight boxing title were destroyed when he was arrested along with another man for the murders of 3 people in a New Jersey bar. Wrongfully accused, Carter and John Artis were sentenced to 3 life terms in prison.",83,87.0,114,"50,000+",Sports & Fitness,drama,$50.7M,"Denzel Washington, Vicellous Reon Shannon, Deborah Kara Unger, Liev Schreiber, John Hannah, Dan Hedaya, Debbi Morgan, Clancy Brown, David Paymer, Harris Yulin, Norman Jewison, Rubin ""Hurricane"" Carter, Sam Chaiton, Terry Swinton, Armyan Bernstein, Dan Gordon, Marc Abraham, Irving Azoff, Armyan Bernstein, Suzann Ellis"
37000000,"[{""id"": 18, ""name"": ""Drama""}]",312221,"[{""id"": 240, ""name"": ""underdog""}, {""id"": 6075, ""name"": ""sport""}, {""id"": 15285, ""name"": ""spin off""}, {""id"": 17977, ""name"": ""underground fighting""}, {""id"": 186779, ""name"": ""motivational speaker""}, {""id"": 209476, ""name"": ""boxing""}]",Creed,"The former World Heavyweight Champion Rocky Balboa serves as a trainer and mentor to Adonis Johnson, the son of his late friend and former rival Apollo Creed.",57.773583,"[{""name"": ""New Line Cinema"", ""id"": 12}, {""name"": ""Warner Bros."", ""id"": 6194}, {""name"": ""Metro-Goldwyn-Mayer (MGM)"", ""id"": 8411}, {""name"": ""Chartoff Winkler Productions"", ""id"": 88686}]","[{""iso_3166_1"": ""US"", ""name"": ""United States of America""}]",2015-11-25,173567581,133.0,Creed,7.3,1915,673,2015,"Adonis Johnson (Michael B. Jordan) never knew his famous father, boxing champion Apollo Creed, who died before Adonis was born. However, boxing is in his blood, so he seeks out Rocky Balboa (Sylvester Stallone) and asks the retired champ to be his trainer. Rocky sees much of Apollo in Adonis, and agrees to mentor him, even as he battles an opponent deadlier than any in the ring. With Rocky's help, Adonis soon gets a title shot, but whether he has the true heart of a fighter remains to be seen.",95,89.0,310,"50,000+",Drama,drama,$109.7M,"Michael B. Jordan, Sylvester Stallone, Tessa Thompson, Phylicia Rashad, Andre Ward, Anthony Bellew, Ritchie Coster, Graham McTavish, Malik Bazille, Ryan Coogler, Ryan Coogler, Aaron Covington, Irwin Winkler, Robert Chartoff, Charles Winkler, William Chartoff, David Winkler, Kevin King-Templeton, Sylvester Stallone"
