budget,genres,id,keywords,original_title,overview,popularity,production_companies,production_countries,release_date,revenue,runtime,title,vote_average,vote_count,Unnamed: 0,year,synopsis,critic_score,people_score,total_reviews,total_ratings,type,genre,box_office_(gross_usa),crew
10000000,"[{""id"": 18, ""name"": ""Drama""}]",21641,"[{""id"": 392, ""name"": ""england""}, {""id"": 5858, ""name"": ""leeds united""}, {""id"": 6075, ""name"": ""sport""}, {""id"": 11343, ""name"": ""brighton""}, {""id"": 13042, ""name"": ""soccer""}, {""id"": 166096, ""name"": ""cup""}, {""id"": 187264, ""name"": ""derby county""}, {""id"": 187265, ""name"": ""management""}, {""id"": 192345, ""name"": ""soccer team""}]",The Damned United,"Taking over Leeds United, Brian Clough's abrasive approach and his clear dislike of the players' dirty style of play make it certain there is going to be friction. Glimpses of his earlier career help explain both his hostility to previous manager Don Revie and how much he is missing right-hand man Peter Taylor",13.409125,"[{""name"": ""BBC Films"", ""id"": 288}, {""name"": ""Columbia Pictures Corporation"", ""id"": 441}, {""name"": ""Screen Yorkshire"", ""id"": 2690}, {""name"": ""Left Bank Pictures"", ""id"": 5340}, {""name"": ""Screen Yorkshire Production Fund"", ""id"": 11560}]","[{""iso_3166_1"": ""GB"", ""name"": ""United Kingdom""}]",2009-03-27,0,97.0,The Damned United,7.2,152,1415,2009,"The story of Brian Clough's 44 day stint as manager of Leeds United Football Club takes place in 1974 England. When Don Revie quits Leeds to become the England boss, the outspoken Brian Clough takes charge. Determined to impose his own style upon Revie's tough tackling team, Clough soon alienates his players and the board. Based on the book by David Pearce.",92,85.0,139,"50,000+",Sports & Fitness,"drama, biography",$449.6K,"Michael Sheen, Timothy Spall, Jim Broadbent, Stephen Graham, Joe Dempsie, Colm Meaney, Martin Compston, Maurice Roëves, Elizabeth Carling, Brian McCardie, Tom Hooper, Peter Morgan, Andy Harries, Hugo Heppell, Christine Langan, Grainne Marmion, Melanie Oliver, Daniel Hubbard"
4000000,"[{""id"": 35, ""name"": ""Comedy""}, {""id"": 27, ""name"": ""Horror""}]",10925,"[{""id"": 293, ""name"": ""female nudity""}, {""id"": 2452, ""name"": ""crematorium""}, {""id"": 2483, ""name"": ""nudity""}, {""id"": 4470, ""name"": ""punk""}, {""id"": 6129, ""name"": ""company""}, {""id"": 10183, ""name"": ""independent film""}, {""id"": 10327, ""name"": ""undead""}, {""id"": 11181, ""name"": ""decapitation""}, {""id"": 12377, ""name"": ""zombie""}, {""id"": 41603, ""name"": ""paramedic""}, {""id"": 155619, ""name"": ""attic""}, {""id"": 157234, ""name"": ""cemetary""}, {""id"": 157444, ""name"": ""dismemberment""}, {""id"": 157892, ""name"": ""warehouse""}, {""id"": 157893, ""name"": ""stairs""}, {""id"": 207492, ""name"": ""night of the living dead""}, {""id"": 207891, ""name"": ""walking dead""}, {""id"": 234040, ""name"": ""louisville""}]",The Return of the Living Dead,"When a bumbling pair of employees at a medical supply warehouse accidentally release a deadly gas into the air, the vapors cause the dead to re-animate as they go on a rampage seeking their favorite food: brains!",14.961629,"[{""name"": ""Hemdale Film Corporation"", ""id"": 469}, {""name"": ""Fox Films Ltd."", ""id"": 4763}, {""name"": ""Cinema 84"", ""id"": 4764}]","[{""iso_3166_1"": ""US"", ""name"": ""United States of America""}]",1985-05-15,14237000,91.0,The Return of the Living Dead,7.3,267,797,1985,"When foreman Frank (James Karen) shows new employee Freddy (Thom Mathews) a secret military experiment in a supply warehouse, the two klutzes accidentally release a gas that reanimates corpses into flesh-eating zombies. As the epidemic spreads throughout Louisville, Ky., and the creatures satisfy their hunger in gory and outlandish ways, Frank and Freddy fight to survive with the help of their boss (Clu Gulager) and a mysterious mortician (Don Calfa).",91,79.0,44,"50,000+",Horror,"comedy, horror",,"Clu Gulager, James Karen, Don Calfa, Thom Mathews, Beverly Randolph, John Philbin, Jewel Shepard, Linnea Quigley, Dan O'Bannon, John Daly, Derek Gibson, Tom Fox, Matt Clifford, Jules Brenner, Robert Gordon, Stanzi Stokes, William Stout"
6000000,"[{""id"": 36, ""name"": ""History""}, {""id"": 18, ""name"": ""Drama""}, {""id"": 37, ""name"": ""Western""}, {""id"": 80, ""name"": ""Crime""}]",642,"[{""id"": 1016, ""name"": ""wyoming""}, {""id"": 6165, ""name"": ""historical figure""}, {""id"": 168374, ""name"": ""loot sharing""}]",Butch Cassidy and the Sundance Kid,"In late 1890s Wyoming, Butch Cassidy is the affable, clever and talkative leader of the outlaw Hole in the Wall Gang. His closest companion is the laconic dead-shot 'Sundance Kid'. As the west rapidly becomes civilized, the law finally catches up to Butch, Sundance and their gang.  Chased doggedly by a special posse, the two decide to make their way to South America in hopes of evading their pursuers once and for all.",24.499996,"[{""name"": ""Twentieth Century Fox Film Corporation"", ""id"": 306}, {""name"": ""Campanile Productions"", ""id"": 381}, {""name"": ""Newman-Foreman Productions"", ""id"": 382}]","[{""iso_3166_1"": ""US"", ""name"": ""United States of America""}]",1969-09-23,102308889,110.0,Butch Cassidy and the Sundance Kid,7.4,650,1547,1969,"The true story of fast-draws and wild rides, battles with posses, train and bank robberies, a torrid love affair and a new lease on outlaw life in far away Bolivia. It is also a character study of a remarkable friendship between Butch - possibly the most likeable outlaw in frontier history - and his closest associate, the fabled, ever-dangerous Sundance Kid.",88,92.0,52,"50,000+",Western,"western, action",,"Paul Newman, Robert Redford, Katharine Ross, Strother Martin, Henry Jones, Jeff Corey, George Furth, Cloris Leachman, Ted Cassidy, Kenneth Mars, George Roy Hill, William Goldman, John Foreman, Paul Monash, Burt Bacharach, Conrad L. Hall, John C. Howard, Richard C. Meyer, Philip M. Jefferies, Jack Martin Smith"
0,"[{""id"": 35, ""name"": ""Comedy""}, {""id"": 10402, ""name"": ""Music""}]",13403,"[{""id"": 108, ""name"": ""transvestism""}, {""id"": 237, ""name"": ""gay""}, {""id"": 572, ""name"": ""sex""}, {""id"": 10229, ""name"": ""singer""}, {""id"": 17975, ""name"": ""transgender""}, {""id"": 33973, ""name"": ""glam rock""}, {""id"": 165601, ""name"": ""self identity""}, {""id"": 165606, ""name"": ""rock odyssey""}, {""id"": 165607, ""name"": ""reference to kant""}, {""id"": 165608, ""name"": ""military brat""}, {""id"": 165612, ""name"": ""restaurant chain""}, {""id"": 165614, ""name"": ""lgbt in the military""}, {""id"": 165615, ""name"": ""child molestation""}, {""id"": 165621, ""name"": ""theatrical manager""}]",Hedwig and the Angry Inch,A transexual punk rock girl from East Berlin tours the US with her rock band as she tells her life story and follows the ex-boyfriend/bandmate who stole her songs.,4.25422,"[{""name"": ""New Line Cinema"", ""id"": 12}, {""name"": ""Killer Films"", ""id"": 1422}]","[{""iso_3166_1"": ""US"", ""name"": ""United States of America""}]",2001-07-20,0,95.0,Hedwig and the Angry Inch,7.4,80,984,2001,"A German emigrant living in a trailer in Kansas is the victim of a botched sex-change operation. Adapted from the critically acclaimed off-Broadway rock theater hit, ""Hedwig and the Angry Inch"" tells the story of the ""internationally ignored"" rock singer, Hedwig, and her search for stardom and love.",92,93.0,116,"25,000+",Musical & Performing Arts,"gay and lesbian, musical",$3.0M,"John Cameron Mitchell, Michael Pitt, Miriam Shor, Stephen Trask, Theodore Liscinski, Rob Campbell, Michael Aranov, Andrea Martin, Ben Mayer-Goodman, Alberta Watson, John Cameron Mitchell, John Cameron Mitchell, Stephen Trask, John Cameron Mitchell, Michael De Luca, Amy Henkels, Mark Tusk, Christine Vachon, Katie Roumel, Pamela Koffler"
5500000,"[{""id"": 18, ""name"": ""Drama""}, {""id"": 36, ""name"": ""History""}]",9443,"[{""id"": 240, ""name"": ""underdog""}, {""id"": 388, ""name"": ""scotland""}, {""id"": 835, ""name"": ""jewry""}, {""id"": 1627, ""name"": ""patriotism""}, {""id"": 2070, ""name"": ""olympic games""}, {""id"": 2606, ""name"": ""jew""}, {""id"": 3044, ""name"": ""olympian sports team""}, {""id"": 3734, ""name"": ""ambition""}]",Chariots of Fire,The true story of British athletes preparing for and competing in the 1924 Summer Olympics.,10.439971,"[{""name"": ""Twentieth Century Fox Film Corporation"", ""id"": 306}, {""name"": ""Warner Bros."", ""id"": 6194}, {""name"": ""Enigma Productions"", ""id"": 7049}, {""name"": ""The Ladd Company"", ""id"": 7965}, {""name"": ""Allied Stars, Ltd."", ""id"": 8770}]","[{""iso_3166_1"": ""GB"", ""name"": ""United Kingdom""}]",1981-05-15,58972904,123.0,Chariots of Fire,6.8,207,1431,1981,"In the class-obsessed and religiously divided United Kingdom of the early 1920s, two determined young runners train for the 1924 Paris Olympics. Eric Liddell (Ian Charleson), a devout Christian born to Scottish missionaries in China, sees running as part of his worship of God's glory and refuses to train or compete on the Sabbath. Harold Abrahams (Ben Cross) overcomes anti-Semitism and class bias, but neglects his beloved sweetheart Sybil (Alice Krige) in his single-minded quest.",82,80.0,73,"25,000+",Sports & Fitness,drama,,"Ben Cross, Ian Charleson, John Gielgud, Nigel Havers, Nicholas Farrell, Ian Holm, Lindsay Anderson, Nigel Davenport, Cheryl Campbell, Alice Krige, Hugh Hudson, Jonathan Benson, Colin Welland, David Puttnam, Dodi Fayed, Jake Eberts, David Watkin, Terry Rawlings"
15000000,"[{""id"": 53, ""name"": ""Thriller""}, {""id"": 878, ""name"": ""Science Fiction""}, {""id"": 18, ""name"": ""Drama""}]",333371,"[{""id"": 1930, ""name"": ""kidnapping""}, {""id"": 2321, ""name"": ""bunker""}, {""id"": 2340, ""name"": ""paranoia""}, {""id"": 9866, ""name"": ""basement""}, {""id"": 10833, ""name"": ""survivalist""}, {""id"": 12332, ""name"": ""apocalypse""}, {""id"": 13063, ""name"": ""car accident""}, {""id"": 15381, ""name"": ""captive""}]",10 Cloverfield Lane,"After a car accident, Michelle awakens to find herself in a mysterious bunker with two men named Howard and Emmett. Howard offers her a pair of crutches to help her remain mobile with her leg injury sustained from the car crash and tells her to ""get good on those"" before leaving the bunker. She has been given the information that there has been an alien attack and the outside world is poisoned. However, Howard and Emmett's intentions soon become questionable and Michelle is faced with a question: Is it better in here or out there?",53.698683,"[{""name"": ""Paramount Pictures"", ""id"": 4}, {""name"": ""Bad Robot"", ""id"": 11461}, {""name"": ""Spectrum Effects"", ""id"": 78177}]","[{""iso_3166_1"": ""US"", ""name"": ""United States of America""}]",2016-03-10,108286421,103.0,10 Cloverfield Lane,6.8,2468,1084,2016,"After surviving a car accident, Michelle (Mary Elizabeth Winstead) wakes up to find herself in an underground bunker with two men. Howard (John Goodman) tells her that a massive chemical attack has rendered the air unbreathable, and their only hope of survival is to remain inside. Despite the comforts of home, Howard's controlling and menacing nature makes Michelle want to escape. After taking matters into her own hands, the young woman finally discovers the truth about the outside world.",90,79.0,312,"50,000+",Mystery & Suspense,mystery and thriller,$72.1M,"John Goodman, Mary Elizabeth Winstead, John Gallagher Jr., Douglas M. Griffin, Suzanne Cryer, Bradley Cooper, Sumalee Montano, Frank Mottek, Dan Trachtenberg, Josh Campbell, Matt Stuecken, Damien Chazelle, J.J. Abrams, Lindsey Weber, Bryan Burk, Drew Goddard, Matt Reeves"
0,"[{""id"": 12, ""name"": ""Adventure""}, {""id"": 28, ""name"": ""Action""}, {""id"": 37, ""name"": ""Western""}]",68818,"[{""id"": 642, ""name"": ""robbery""}, {""id"": 4781, ""name"": ""miner""}, {""id"": 44042, ""name"": ""treachery""}, {""id"": 44413, ""name"": ""sundance kid""}, {""id"": 47972, ""name"": ""native peoples""}, {""id"": 130989, ""name"": ""butch cassidy""}]",Blackthorn,"In Bolivia, Butch Cassidy (now calling himself James Blackthorne) pines for one last sight of home, an adventure that aligns him with a young robber and makes the duo a target for gangs and lawmen alike.",5.223096,"[{""name"": ""Quickfire Films"", ""id"": 4186}, {""name"": ""Televisi\u00f3n Espa\u00f1ola (TVE)"", ""id"": 6639}, {""name"": ""Arcadia Motion Pictures"", ""id"": 7543}, {""name"": ""Noodles Production"", ""id"": 7792}, {""name"": ""Canal+ Espa\u00f1a"", ""id"": 9335}, {""name"": ""Instituto de la Cinematograf\u00eda y de las Artes Audiovisuales (ICAA)"", ""id"": 9974}, {""name"": ""Instituto de Cr\u00e9dito Oficial (ICO)"", ""id"": 11427}, {""name"": ""ONO"", ""id"": 40789}, {""name"": ""Ariane Marar\u00eda Films"", ""id"": 53194}, {""name"": ""Nix Films"", ""id"": 53195}, {""name"": ""Eter Pictures"", ""id"": 53196}, {""name"": ""Manto Films"", ""id"": 53197}, {""name"": ""Pegaso Producciones"", ""id"": 53198}, {""name"": ""Ibermedia European Community Program"", ""id"": 53199}, {""name"": ""Audiovisual Aval SGR"", ""id"": 53200}]","[{""iso_3166_1"": ""BO"", ""name"": ""Bolivia""}, {""iso_3166_1"": ""FR"", ""name"": ""France""}, {""iso_3166_1"": ""ES"", ""name"": ""Spain""}, {""iso_3166_1"": ""GB"", ""name"": ""United Kingdom""}]",2011-08-31,623528,98.0,Blackthorn,6.6,73,1573,2011,"Leaving Bolivia and heading back to the U.S., the outlaw formerly known as Butch Cassidy (Sam Shepard) has a final adventure.",75,61.0,75,"1,000+",Western,"western, adventure, action",$199.7K,"Sam Shepard, Eduardo Noriega, Stephen Rea, Magaly Solier, Nikolaj Coster-Waldau, Padraic Delaney, Dominique McElligott, Mateo Gil, Miguel Barros, Andres Santana"
3000000,"[{""id"": 18, ""name"": ""Drama""}]",510,"[{""id"": 30, ""name"": ""individual""}, {""id"": 526, ""name"": ""rebel""}, {""id"": 1824, ""name"": ""self-destruction""}, {""id"": 2564, ""name"": ""wheelchair""}, {""id"": 2574, ""name"": ""lunatic asylum""}, {""id"": 3737, ""name"": ""dying and death""}, {""id"": 3927, ""name"": ""rage and hate""}, {""id"": 6089, ""name"": ""freedom""}, {""id"": 6255, ""name"": ""insanity""}, {""id"": 6334, ""name"": ""basic rights and human rights""}, {""id"": 15106, ""name"": ""psychiatrist""}]",One Flew Over the Cuckoo's Nest,"While serving time for insanity at a state mental hospital, implacable rabble-rouser, Randle Patrick McMurphy inspires his fellow patients to rebel against the authoritarian rule of head nurse, Mildred Ratched.",127.525581,"[{""name"": ""United Artists"", ""id"": 60}, {""name"": ""Fantasy Films"", ""id"": 286}, {""name"": ""Warner Bros."", ""id"": 6194}]","[{""iso_3166_1"": ""US"", ""name"": ""United States of America""}]",1975-11-18,108981275,133.0,One Flew Over the Cuckoo's Nest,8.2,2919,396,1975,"When Randle Patrick McMurphy (Jack Nicholson) gets transferred for evaluation from a prison farm to a mental institution, he assumes it will be a less restrictive environment. But the martinet Nurse Ratched (Louise Fletcher) runs the psychiatric ward with an iron fist, keeping her patients cowed through abuse, medication and sessions of electroconvulsive therapy. The battle of wills between the rebellious McMurphy and the inflexible Ratched soon affects all the ward's patients.",94,96.0,81,"250,000+",Classics,drama,,"Jack Nicholson, Louise Fletcher, Brad Dourif, William Redfield, Michael Berryman, Peter Brocco, Dean R. Brooks, Scatman Crothers, Danny DeVito, Milos Forman, Michael Douglas, Saul Zaentz, Jack Nitzsche, Haskell Wexler, Sheldon Kahn, Lynzee Klingman, Jane Feinberg, Mike Fenton, Paul Sylbert"
114000,"[{""id"": 27, ""name"": ""Horror""}]",10331,"[{""id"": 1155, ""name"": ""brother sister relationship""}, {""id"": 1227, ""name"": ""cemetery""}, {""id"": 1419, ""name"": ""gun""}, {""id"": 1420, ""name"": ""gas station""}, {""id"": 1872, ""name"": ""loss of father""}, {""id"": 2602, ""name"": ""cellar""}, {""id"": 6095, ""name"": ""house""}, {""id"": 7246, ""name"": ""barricade""}, {""id"": 12377, ""name"": ""zombie""}, {""id"": 18029, ""name"": ""trapped""}, {""id"": 155561, ""name"": ""bitten""}]",Night of the Living Dead,"A group of people try to survive an attack of bloodthirsty zombies while trapped in a rural Pennsylvania farmhouse. Although not the first zombie film, Night of the Living Dead is the progenitor of the contemporary ""zombie apocalypse"" horror film, and it greatly influenced the modern pop-culture zombie archetype.",25.666029,"[{""name"": ""Laurel Group"", ""id"": 638}, {""name"": ""Off Color Films"", ""id"": 3139}, {""name"": ""Image Ten"", ""id"": 14121}, {""name"": ""Market Square Productions"", ""id"": 14122}]","[{""iso_3166_1"": ""US"", ""name"": ""United States of America""}]",1968-10-01,30000000,96.0,Night of the Living Dead,7.5,580,374,1968,"A disparate group of individuals takes refuge in an abandoned house when corpses begin to leave the graveyard in search of fresh human bodies to devour. The pragmatic Ben (Duane Jones) does his best to control the situation, but when the reanimated bodies surround the house, the other survivors begin to panic. As any semblance of order within the group begins to dissipate, the zombies start to find ways inside -- and one by one, the living humans become the prey of the deceased ones.",97,87.0,70,"100,000+",Classics,horror,$68.7K,"Duane Jones, Judith O'Dea, Karl Hardman, Keith Wayne, Judith Ridley, Marilyn Eastman, Kyra Schon, Charles Craig, George Kosana, Russell Streiner, George A. Romero, George A. Romero, John A. Russo, Karl Hardman, Russell W. Streiner, George A. Romero, George A. Romero, Karl Hardman, George Kosana"
4000000,"[{""id"": 18, ""name"": ""Drama""}]",153,"[{""id"": 213, ""name"": ""upper class""}, {""id"": 922, ""name"": ""hotel room""}, {""id"": 965, ""name"": ""age difference""}, {""id"": 1004, ""name"": ""commercial""}, {""id"": 1005, ""name"": ""karaoke""}, {""id"": 1007, ""name"": ""homesickness""}, {""id"": 1463, ""name"": ""culture clash""}, {""id"": 1895, ""name"": ""jet lag""}, {""id"": 3490, ""name"": ""pop star""}, {""id"": 6059, ""name"": ""unsociability""}, {""id"": 179430, ""name"": ""aftercreditsstinger""}, {""id"": 187056, ""name"": ""woman director""}]",Lost in Translation,"Two lost souls visiting Tokyo -- the young, neglected wife of a photographer and a washed-up movie star shooting a TV commercial -- find an odd solace and pensive freedom to be real in each other's company, away from their lives in America.",45.66662,"[{""name"": ""American Zoetrope"", ""id"": 70}]","[{""iso_3166_1"": ""JP"", ""name"": ""Japan""}, {""iso_3166_1"": ""US"", ""name"": ""United States of America""}]",2003-08-31,119723856,102.0,Lost in Translation,7.3,1895,498,2003,"A lonely, aging movie star named Bob Harris (Bill Murray) and a conflicted newlywed, Charlotte (Scarlett Johansson), meet in Tokyo. Bob is there to film a Japanese whiskey commercial; Charlotte is accompanying her celebrity-photographer husband. Strangers in a foreign land, the two find escape, distraction and understanding amidst the bright Tokyo lights after a chance meeting in the quiet lull of the hotel bar. They form a bond that is as unlikely as it is heartfelt and meaningful.",95,85.0,232,"250,000+",Comedy,"drama, comedy",$44.6M,"Bill Murray, Scarlett Johansson, Giovanni Ribisi, Anna Faris, Fumihiro Hayashi, Catherine Lambert, Gregory Pekar, Sofia Coppola, Sofia Coppola, Sofia Coppola, Ross Katz, Francis Ford Coppola, Fred Roos, Lance Acord, Anne Ross, K.K. Barrett, Nancy Steiner"
4000000,"[{""id"": 35, ""name"": ""Comedy""}, {""id"": 18, ""name"": ""Drama""}, {""id"": 10749, ""name"": ""Romance""}]",703,"[{""id"": 2398, ""name"": ""narration""}, {""id"": 2835, ""name"": ""neurosis""}, {""id"": 3485, ""name"": ""comedian""}, {""id"": 3489, ""name"": ""job interview""}, {""id"": 9673, ""name"": ""love""}, {""id"": 10229, ""name"": ""singer""}, {""id"": 11508, ""name"": ""jewish""}, {""id"": 11687, ""name"": ""breaking the fourth wall""}, {""id"": 160442, ""name"": ""talking to the audience""}, {""id"": 162463, ""name"": ""volkswagen beetle""}]",Annie Hall,"In the city of New York, comedian Alvy Singer falls in love with the ditsy Annie Hall.",35.892034,"[{""name"": ""United Artists"", ""id"": 60}]","[{""iso_3166_1"": ""US"", ""name"": ""United States of America""}]",1977-04-19,38251425,93.0,Annie Hall,7.8,1010,453,1977,"Comedian Alvy Singer (Woody Allen) examines the rise and fall of his relationship with struggling nightclub singer Annie Hall (Diane Keaton). Speaking directly to the audience in front of a bare background, Singer reflects briefly on his childhood and his early adult years before settling in to tell the story of how he and Annie met, fell in love, and struggled with the obstacles of modern romance, mixing surreal fantasy sequences with small moments of emotional drama.",96,92.0,83,"100,000+",Comedy,romance,,"Woody Allen, Diane Keaton, Tony Roberts, Carol Kane, Paul Simon, Colleen Dewhurst, Janet Margolin, Shelley Duvall, Christopher Walken, Donald Symington, Woody Allen, Woody Allen, Marshall Brickman, Fred T. Gallo, Robert Greenhut, Charles H. Joffe, Jack Rollins, Gordon Willis, Wendy Greene Bricmont, Ralph Rosenblum"
0,"[{""id"": 99, ""name"": ""Documentary""}]",19153,"[{""id"": 10183, ""name"": ""independent film""}]",The Real Cancun,"Sixteen American college students drink, flirt, fight and canoodle during their Spring Break vacation in Cancun, Mexico.",0.456485,[],"[{""iso_3166_1"": ""US"", ""name"": ""United States of America""}]",2003-04-23,0,96.0,The Real Cancun,3.3,8,1520,2003,"The annual debauchery of college students during spring break is examined in this documentary, which focuses on 16 young Americans as they travel to Cancun, Mexico, where they indulge in voluminous consumption of sex and booze. Over the course of 11 days, the students -- including such archetypes as a ladies' man, a party girl and a virgin -- are followed by cameras as they drink profusely and attempt to hook up with as many members of the opposite sex as circumstances allow.",34,29.0,90,"2,500+",Television,documentary,$3.7M,"Benjamin ""Fletch"" Fletcher, Roxanne Frilot, Nicole Frilot, Brittany Brown-Hart, David Ingber, Jeremy Jazwinski, Amber Madison, Paul Malbry, Marquita ""Sky"" Marshall, Laura Ramsey, Rick de Oliveira, A.J. Dix, Anthony Rhulen, William Shively, Mary-Ellis Bunim, Jonathan Murray, Richard Brener, Toby Emmerich, Jamie Schutz, Rick de Oliveira"
0,"[{""id"": 27, ""name"": ""Horror""}]",46420,"[{""id"": 627, ""name"": ""killing""}, {""id"": 6270, ""name"": ""high school""}, {""id"": 9693, ""name"": ""female killer""}, {""id"": 9748, ""name"": ""revenge""}, {""id"": 10266, ""name"": ""prom""}, {""id"": 10685, ""name"": ""escape""}, {""id"": 13130, ""name"": ""teenager""}]",The Loved Ones,"Lola Stone asked Brent Mitchell to the prom, but Brent said no, and now he's screwed. What happens when Lola doesn't get what she wants? She enlists Daddy's help to throw a prom of her own, where she is queen and Brent is king -- whether he likes it or not. THE LOVED ONES is what happens when puppy love goes horribly, violently wrong. Brent should have said yes...",4.989985,"[{""name"": ""Omnilab Media"", ""id"": 2729}, {""name"": ""Ambience Entertainment"", ""id"": 3427}, {""name"": ""Screen Australia"", ""id"": 7584}, {""name"": ""Film Victoria"", ""id"": 11840}]","[{""iso_3166_1"": ""AU"", ""name"": ""Australia""}]",2009-09-13,0,84.0,The Loved Ones,6.6,207,750,2009,"After a classmate (Xavier Samuel) declines her invitation to the school dance, a teenager (Robin McLeavy) kidnaps him and makes him the guest of honor at her own twisted prom.",98,73.0,58,"10,000+",Horror,"mystery and thriller, horror",,"Xavier Samuel, Robin McLeavy, Jessica McNamee, Victoria Thaine, John Brumpton, Andrew S. Gilbert, Suzi Dougherty, Victoria Eagger, Sean Byrne, Sean Byrne, Mark Lazarus, Michael Boughen, Matthew Street, David Whealy"
3500000,"[{""id"": 35, ""name"": ""Comedy""}]",9427,"[{""id"": 1252, ""name"": ""suicide attempt""}, {""id"": 4378, ""name"": ""striptease""}, {""id"": 164852, ""name"": ""steel worker""}, {""id"": 164861, ""name"": ""repossession""}, {""id"": 164865, ""name"": ""male stripper""}]",The Full Monty,"Sheffield, England. Gaz, a jobless steelworker in need of quick cash persuades his mates to bare it all in a one-night-only strip show.",17.002623,"[{""name"": ""Channel Four Films"", ""id"": 181}, {""name"": ""Twentieth Century Fox Film Corporation"", ""id"": 306}, {""name"": ""Redwave Films"", ""id"": 8764}]","[{""iso_3166_1"": ""GB"", ""name"": ""United Kingdom""}]",1997-08-13,257850122,91.0,The Full Monty,6.8,363,952,1997,"After losing his job at a steel factory, Gaz (Robert Carlyle) learns that his wife wants to sue him for missed child support payments. Desperate for money, Gaz and his friend Dave (Mark Addy) decide to create their own male strip-tease act. The two friends recruit four more men, including their former foreman (Tom Wilkinson) and a security guard (Steve Huison). The group promises that their show will succeed because they are willing to go ""the Full Monty"": completely naked.",96,79.0,50,"100,000+",Musical & Performing Arts,comedy,$45.9M,"Robert Carlyle, Tom Wilkinson, Mark Addy, Lesley Sharp, Emily Woof, Steve Huison, Paul Barber, Hugo Speer, Deirdre Costello, Bruce Jones, Peter Cattaneo, Simon Beaufoy, Uberto Pasolini, Anne Dudley, John de Borman, David Freeman, Nick Moore, Susie Figgis, Max Gottlieb, Chris Roope"
