budget,genres,id,keywords,original_title,overview,popularity,production_companies,production_countries,release_date,revenue,runtime,title,vote_average,vote_count,Unnamed: 0,year,synopsis,critic_score,people_score,total_reviews,total_ratings,type,genre,box_office_(gross_usa),crew
19000000,"[{""id"": 80, ""name"": ""Crime""}, {""id"": 18, ""name"": ""Drama""}, {""id"": 53, ""name"": ""Thriller""}]",274,"[{""id"": 818, ""name"": ""based on novel""}, {""id"": 6259, ""name"": ""psychopath""}, {""id"": 8087, ""name"": ""horror""}, {""id"": 9937, ""name"": ""suspense""}, {""id"": 10714, ""name"": ""serial killer""}, {""id"": 12565, ""name"": ""psychological thriller""}, {""id"": 14895, ""name"": ""cannibal""}, {""id"": 18525, ""name"": ""fbi agent""}, {""id"": 33872, ""name"": ""animal in cast credits""}, {""id"": 208048, ""name"": ""cannibalism""}]",The Silence of the Lambs,"FBI trainee, Clarice Starling ventures into a maximum-security asylum to pick the diseased brain of Hannibal Lecter, a psychiatrist turned homicidal cannibal. Starling needs clues to help her capture a serial killer. but her Faustian relationship with Lecter soon leads to his escape, and now two deranged killers are on the loose.",18.174804,"[{""name"": ""Orion Pictures"", ""id"": 41}, {""name"": ""Strong Heart/Demme Production"", ""id"": 55072}]","[{""iso_3166_1"": ""US"", ""name"": ""United States of America""}]",1991-02-01,272742922,119.0,The Silence of the Lambs,8.1,4443,718,1991,"Jodie Foster stars as Clarice Starling, a top student at the FBI's training academy. Jack Crawford (Scott Glenn) wants Clarice to interview Dr. Hannibal Lecter (Anthony Hopkins), a brilliant psychiatrist who is also a violent psychopath, serving life behind bars for various acts of murder and cannibalism. Crawford believes that Lecter may have insight into a case and that Starling, as an attractive young woman, may be just the bait to draw him out.",96,95.0,103,"250,000+",Horror,"mystery and thriller, crime, drama",$130.7M,"Jodie Foster, Anthony Hopkins, Scott Glenn, Ted Levine, Anthony Heald, Brooke Smith, Diane Baker, Kasi Lemmons, Charles Napier, Roger Corman, Jonathan Demme, Thomas Harris, Ted Tally, Grace Blake, Ron Bozman, Gary Goetzman, Edward Saxon, Kenneth Utt, Howard Shore, Tak Fujimoto"
20000000,"[{""id"": 18, ""name"": ""Drama""}, {""id"": 36, ""name"": ""History""}]",76203,"[{""id"": 1294, ""name"": ""whip""}, {""id"": 1930, ""name"": ""kidnapping""}, {""id"": 2831, ""name"": ""slavery""}, {""id"": 3136, ""name"": ""plantation""}, {""id"": 4225, ""name"": ""night shift""}, {""id"": 15189, ""name"": ""violin player""}, {""id"": 155794, ""name"": ""physical abuse""}, {""id"": 190477, ""name"": ""cotton""}, {""id"": 197643, ""name"": ""slave owner""}, {""id"": 207928, ""name"": ""19th century""}, {""id"": 209069, ""name"": ""sold into slavery""}, {""id"": 209070, ""name"": ""abolitionist""}]",12 Years a Slave,"In the pre-Civil War United States, Solomon Northup, a free black man from upstate New York, is abducted and sold into slavery. Facing cruelty as well as unexpected kindnesses Solomon struggles not only to stay alive, but to retain his dignity. In the twelfth year of his unforgettable odyssey, Solomon’s chance meeting with a Canadian abolitionist will forever alter his life.",95.9229,"[{""name"": ""Plan B Entertainment"", ""id"": 81}, {""name"": ""Regency Enterprises"", ""id"": 508}, {""name"": ""River Road Entertainment"", ""id"": 1246}, {""name"": ""Film4"", ""id"": 9349}, {""name"": ""New Regency Pictures"", ""id"": 10104}]","[{""iso_3166_1"": ""US"", ""name"": ""United States of America""}, {""iso_3166_1"": ""GB"", ""name"": ""United Kingdom""}]",2013-10-18,187000000,134.0,12 Years a Slave,7.9,3674,636,2013,"In the years before the Civil War, Solomon Northup (Chiwetel Ejiofor), a free black man from upstate New York, is kidnapped and sold into slavery in the South. Subjected to the cruelty of one malevolent owner (Michael Fassbender), he also finds unexpected kindness from another, as he struggles continually to survive and maintain some of his dignity. Then in the 12th year of the disheartening ordeal, a chance meeting with an abolitionist from Canada changes Solomon's life forever.",95,90.0,371,"100,000+",Drama,"drama, history, biography",$56.7M,"Chiwetel Ejiofor, Michael Fassbender, Benedict Cumberbatch, Paul Dano, Garret Dillahunt, Paul Giamatti, Scoot McNairy, Lupita Nyong'o, Adepero Oduye, Sarah Paulson, Steve McQueen, John Ridley, Brad Pitt, Dede Gardner, Jeremy Kleiner, Bill Pohlad, Steve McQueen, Arnon Milchan, Anthony Katagas, John Ridley"
1800000,"[{""id"": 28, ""name"": ""Action""}, {""id"": 80, ""name"": ""Crime""}, {""id"": 53, ""name"": ""Thriller""}]",1051,"[{""id"": 796, ""name"": ""police brutality""}, {""id"": 916, ""name"": ""marseille""}, {""id"": 1759, ""name"": ""night life""}, {""id"": 2013, ""name"": ""attempted murder""}, {""id"": 2231, ""name"": ""drug dealer""}, {""id"": 2235, ""name"": ""drug mule""}, {""id"": 3149, ""name"": ""gangster boss""}, {""id"": 3391, ""name"": ""drug smuggle""}, {""id"": 4654, ""name"": ""undercover agent""}, {""id"": 4655, ""name"": ""hijacking of train""}, {""id"": 238010, ""name"": ""herion""}]",The French Connection,Tough narcotics detective 'Popeye' Doyle is in hot pursuit of a suave French drug dealer who may be the key to a huge heroin-smuggling operation.,15.978136,"[{""name"": ""Twentieth Century Fox Film Corporation"", ""id"": 306}, {""name"": ""D'Antoni Productions"", ""id"": 646}, {""name"": ""Schine-Moore Productions"", ""id"": 73950}]","[{""iso_3166_1"": ""US"", ""name"": ""United States of America""}]",1971-10-09,41158757,104.0,The French Connection,7.4,422,55,1971,"New York Detective ""Popeye"" Doyle (Gene Hackman) and his partner (Roy Scheider) chase a French heroin smuggler.",98,87.0,61,"25,000+",Action & Adventure,"crime, drama, mystery and thriller",,"Gene Hackman, Fernando Rey, Roy Scheider, Tony Lo Bianco, Marcel Bozzuffi, Frédéric de Pasquale, Bill Hickman, Ann Rebbot, Harold Gary, Arlene Farber, William Friedkin, G. David Schine, Kenneth Utt, Owen Roizman, Robert Weiner, Ben Kazaskow, William C. Gerrity, Terence A. Donnelly"
20000000,"[{""id"": 18, ""name"": ""Drama""}, {""id"": 53, ""name"": ""Thriller""}, {""id"": 36, ""name"": ""History""}]",314365,"[{""id"": 516, ""name"": ""child abuse""}, {""id"": 917, ""name"": ""journalism""}, {""id"": 934, ""name"": ""judge""}, {""id"": 1196, ""name"": ""florida""}, {""id"": 1680, ""name"": ""boston""}, {""id"": 2337, ""name"": ""pedophilia""}, {""id"": 6148, ""name"": ""court""}, {""id"": 9665, ""name"": ""cover-up""}, {""id"": 10093, ""name"": ""priest""}, {""id"": 10909, ""name"": ""lawyer""}, {""id"": 18396, ""name"": ""catholic""}, {""id"": 157008, ""name"": ""catholic church""}, {""id"": 161207, ""name"": ""catholicism""}, {""id"": 161304, ""name"": ""september 11 2001""}, {""id"": 195240, ""name"": ""investigative journalism""}, {""id"": 204357, ""name"": ""cardinal""}, {""id"": 207317, ""name"": ""christmas""}]",Spotlight,"The true story of how The Boston Globe uncovered the massive scandal of child abuse and the cover-up within the local Catholic Archdiocese, shaking the entire Catholic Church to its core.",41.503588,"[{""name"": ""Universal Pictures"", ""id"": 33}, {""name"": ""Participant Media"", ""id"": 6735}, {""name"": ""Anonymous Content"", ""id"": 10039}, {""name"": ""Rocklin / Faust"", ""id"": 42421}, {""name"": ""First Look Media"", ""id"": 75807}]","[{""iso_3166_1"": ""CA"", ""name"": ""Canada""}, {""iso_3166_1"": ""US"", ""name"": ""United States of America""}]",2015-11-06,88346473,128.0,Spotlight,7.8,2686,622,2015,"In 2001, editor Marty Baron of The Boston Globe assigns a team of journalists to investigate allegations against John Geoghan, an unfrocked priest accused of molesting more than 80 boys. Led by editor Walter ""Robby"" Robinson (Michael Keaton), reporters Michael Rezendes (Mark Ruffalo), Matt Carroll and Sacha Pfeiffer interview victims and try to unseal sensitive documents. The reporters make it their mission to provide proof of a cover-up of sexual abuse within the Roman Catholic Church.",97,93.0,371,"50,000+",Drama,drama,$45.0M,"Mark Ruffalo, Michael Keaton, Rachel McAdams, Liev Schreiber, John Slattery, Brian d'Arcy James, Stanley Tucci, Billy Crudup, Jamey Sheridan, Tom McCarthy, Josh Singer, Tom McCarthy, Michael Sugar, Steve Golin, Nicole Rocklin, Blye Pagon Faust, Jeff Skoll, Jonathan King, Pierre Omidyar"
20000000,"[{""id"": 35, ""name"": ""Comedy""}, {""id"": 18, ""name"": ""Drama""}, {""id"": 10749, ""name"": ""Romance""}, {""id"": 53, ""name"": ""Thriller""}]",9895,"[{""id"": 840, ""name"": ""usa president""}, {""id"": 2946, ""name"": ""presidential election""}, {""id"": 3485, ""name"": ""comedian""}]",Man of the Year,"The irreverent host of a political satire talk show decides to run for president and expose corruption in Washington. His stunt goes further than he expects when he actually wins the election, but a software engineer suspects that a computer glitch is responsible for his surprising victory.",11.203335,"[{""name"": ""Universal Pictures"", ""id"": 33}, {""name"": ""Morgan Creek Productions"", ""id"": 10210}]","[{""iso_3166_1"": ""US"", ""name"": ""United States of America""}]",2006-10-09,41237648,115.0,Man of the Year,5.8,129,1522,2006,"Tom Dobbs (Robin Williams), the satirical host of a political talk show, decides to shake things up by running for president after making comments that he would be a better president than the leader who currently occupies the White House. His fans begin a grassroots campaign that catapults him into the Oval Office, but soon after moving in it is revealed a computer glitch mistakenly awarded him the presidency. Tom is left with a tough choice, stay the course or head back behind the microphone.",21,45.0,147,"100,000+",Television,comedy,$37.4M,"Robin Williams, Laura Linney, Christopher Walken, Lewis Black, Jeff Goldblum, Rick Roberts, David Alpay, Karen Hines, Linda Kash, Sasha Roiz, Barry Levinson, Barry Levinson, Barry Levinson, Robert N. Fried, James G. Robinson, David Coatsworth, Guy McElwaine, David C. Robinson, Dick Pope, Stu Linder"
20000000,"[{""id"": 878, ""name"": ""Science Fiction""}, {""id"": 18, ""name"": ""Drama""}, {""id"": 10749, ""name"": ""Romance""}]",38,"[{""id"": 563, ""name"": ""deja vu""}, {""id"": 802, ""name"": ""regret""}, {""id"": 931, ""name"": ""jealousy""}, {""id"": 1453, ""name"": ""amnesia""}, {""id"": 1566, ""name"": ""dream""}, {""id"": 1604, ""name"": ""operation""}, {""id"": 5625, ""name"": ""relationship problems""}, {""id"": 9673, ""name"": ""love""}, {""id"": 10937, ""name"": ""memory""}, {""id"": 12400, ""name"": ""brainwashing""}, {""id"": 14534, ""name"": ""relationship""}, {""id"": 34265, ""name"": ""heartbreak""}, {""id"": 157171, ""name"": ""nonlinear timeline""}, {""id"": 204374, ""name"": ""love story""}, {""id"": 224279, ""name"": ""bittersweet""}]",Eternal Sunshine of the Spotless Mind,"Joel Barish, heartbroken that his girlfriend underwent a procedure to erase him from her memory, decides to do the same. However, as he watches his memories of her fade away, he realises that he still loves her, and may be too late to correct his mistake.",56.481487,"[{""name"": ""Anonymous Content"", ""id"": 10039}, {""name"": ""This Is That Productions"", ""id"": 10059}, {""name"": ""Focus Features"", ""id"": 10146}]","[{""iso_3166_1"": ""US"", ""name"": ""United States of America""}]",2004-03-19,72258126,108.0,Eternal Sunshine of the Spotless Mind,7.9,3652,1183,2004,"After a painful breakup, Clementine (Kate Winslet) undergoes a procedure to erase memories of her former boyfriend Joel (Jim Carrey) from her mind. When Joel discovers that Clementine is going to extremes to forget their relationship, he undergoes the same procedure and slowly begins to forget the woman that he loved. Directed by former music video director Michel Gondry, the visually arresting film explores the intricacy of relationships and the pain of loss.",92,94.0,250,"250,000+",Romance,"sci fi, romance",$34.1M,"Jim Carrey, Kate Winslet, Kirsten Dunst, Mark Ruffalo, Elijah Wood, Tom Wilkinson, Jane Adams, David Cross, Deirdre O'Connell, Debbon Ayer, Michel Gondry, Anthony Bregman, Steve Golin, David L. Bushell, Charlie Kaufman, Michel Gondry, Jon Brion, Ellen Kuras, Valdís Óskarsdóttir"
806948,"[{""id"": 18, ""name"": ""Drama""}, {""id"": 27, ""name"": ""Horror""}, {""id"": 53, ""name"": ""Thriller""}]",539,"[{""id"": 612, ""name"": ""hotel""}, {""id"": 1443, ""name"": ""clerk""}, {""id"": 1859, ""name"": ""arizona""}, {""id"": 1879, ""name"": ""shower""}, {""id"": 2217, ""name"": ""rain""}, {""id"": 2669, ""name"": ""motel""}, {""id"": 10594, ""name"": ""money""}, {""id"": 11677, ""name"": ""secretary""}, {""id"": 13092, ""name"": ""corpse""}, {""id"": 13112, ""name"": ""murderer""}, {""id"": 14604, ""name"": ""theft""}, {""id"": 155790, ""name"": ""private detective""}, {""id"": 233450, ""name"": ""proto-slasher""}]",Psycho,"When larcenous real estate clerk Marion Crane goes on the lam with a wad of cash and hopes of starting a new life, she ends up at the notorious Bates Motel, where manager Norman Bates cares for his housebound mother. The place seems quirky, but fine… until Marion decides to take a shower.",93.067866,"[{""name"": ""Paramount Pictures"", ""id"": 4}, {""name"": ""Universal Pictures"", ""id"": 33}, {""name"": ""Shamley Productions"", ""id"": 10717}]","[{""iso_3166_1"": ""US"", ""name"": ""United States of America""}]",1960-06-16,32000000,109.0,Psycho,8.2,2320,319,1960,"Phoenix secretary Marion Crane (Janet Leigh), on the lam after stealing $40,000 from her employer in order to run away with her boyfriend, Sam Loomis (John Gavin), is overcome by exhaustion during a heavy rainstorm. Traveling on the back roads to avoid the police, she stops for the night at the ramshackle Bates Motel and meets the polite but highly strung proprietor Norman Bates (Anthony Perkins), a young man with an interest in taxidermy and a difficult relationship with his mother.",96,95.0,103,"100,000+",Classics,"mystery and thriller, horror",,"Anthony Perkins, Janet Leigh, Vera Miles, John Gavin, Martin Balsam, John McIntire, Simon Oakland, John Anderson, Frank Albertson, Patricia Hitchcock, Alfred Hitchcock, Robert Bloch, Joseph Stefano, Alfred Hitchcock, Bernard Herrmann, John L. Russell, George Tomasini"
2000000,"[{""id"": 28, ""name"": ""Action""}, {""id"": 12, ""name"": ""Adventure""}, {""id"": 80, ""name"": ""Crime""}, {""id"": 18, ""name"": ""Drama""}, {""id"": 53, ""name"": ""Thriller""}, {""id"": 37, ""name"": ""Western""}]",16608,"[{""id"": 2125, ""name"": ""gallows""}, {""id"": 5657, ""name"": ""australia""}, {""id"": 6259, ""name"": ""psychopath""}, {""id"": 9503, ""name"": ""outlaw""}, {""id"": 9622, ""name"": ""misanthrope""}, {""id"": 10726, ""name"": ""gang""}, {""id"": 10950, ""name"": ""shootout""}, {""id"": 13125, ""name"": ""sadist""}, {""id"": 14707, ""name"": ""brutality""}, {""id"": 14819, ""name"": ""violence""}, {""id"": 161231, ""name"": ""hideout""}, {""id"": 162388, ""name"": ""retribution""}, {""id"": 170314, ""name"": ""flogging""}, {""id"": 170335, ""name"": ""whipping""}, {""id"": 187355, ""name"": ""sunset""}, {""id"": 209619, ""name"": ""aborigine""}, {""id"": 238128, ""name"": ""savagery""}]",The Proposition,"Set in the Australian outback in the 1880s, the movie follows the series of events following the horrific rape and murder of the Hopkins family, allegedly committed by the infamous Burns brothers gang. Captain Morris Stanley captures Charlie Burns and gives him 9 days to kill his older dangerous psychopathic brother, or else they'll hang his younger mentally slow brother on Christmas Day.",14.617944,"[{""name"": ""Autonomous"", ""id"": 2326}, {""name"": ""UK Film Council"", ""id"": 2452}, {""name"": ""Surefire Film Productions"", ""id"": 3205}, {""name"": ""Pictures in Paradise"", ""id"": 3207}, {""name"": ""Pacific Film and Television Commission"", ""id"": 4024}, {""name"": ""Film Consortium"", ""id"": 20455}, {""name"": ""National Lottery through UK Film Council"", ""id"": 20456}]","[{""iso_3166_1"": ""AU"", ""name"": ""Australia""}, {""iso_3166_1"": ""GB"", ""name"": ""United Kingdom""}]",2005-10-06,5048693,104.0,The Proposition,7.1,218,1558,2005,"In 1880s Australia, a lawman (Ray Winstone) offers renegade Charlie Burns (Guy Pearce) a difficult choice. In order to save his younger brother from the gallows, Charlie must hunt down and kill his older brother (Danny Huston), who is wanted for rape and murder. Venturing into one of the Outback's most inhospitable regions, Charlie faces a terrible moral dilemma that can end only in violence.",85,85.0,129,"50,000+",Western,"drama, action, western",$1.9M,"Guy Pearce, Ray Winstone, Emily Watson, Danny Huston, John Hurt, David Wenham, Noah Taylor, David Gulpilil, Leah Purcell, Nick Cave, John Hillcoat, Cat Villiers, Chiara Menage, Jackie O'Sullivan, Sara Giles, Michael Hamlyn, Chris Auty, James Atherton"
19000000,"[{""id"": 12, ""name"": ""Adventure""}, {""id"": 35, ""name"": ""Comedy""}, {""id"": 878, ""name"": ""Science Fiction""}, {""id"": 10751, ""name"": ""Family""}]",105,"[{""id"": 389, ""name"": ""clock tower""}, {""id"": 830, ""name"": ""car race""}, {""id"": 949, ""name"": ""terrorist""}, {""id"": 951, ""name"": ""delorean""}, {""id"": 952, ""name"": ""lightning""}, {""id"": 953, ""name"": ""guitar""}, {""id"": 955, ""name"": ""plutonium""}, {""id"": 999, ""name"": ""sports car""}, {""id"": 1436, ""name"": ""inventor""}, {""id"": 1743, ""name"": ""journey in the past""}, {""id"": 4379, ""name"": ""time travel""}, {""id"": 4776, ""name"": ""race against time""}, {""id"": 9104, ""name"": ""partner""}, {""id"": 9789, ""name"": ""misfit""}, {""id"": 10125, ""name"": ""mad scientist""}, {""id"": 11860, ""name"": ""fish out of water""}, {""id"": 18425, ""name"": ""teenage love""}, {""id"": 40850, ""name"": ""destiny""}, {""id"": 186189, ""name"": ""hidden identity""}, {""id"": 187376, ""name"": ""odd couple""}, {""id"": 187710, ""name"": ""escapade""}, {""id"": 189449, ""name"": ""disorder""}, {""id"": 206687, ""name"": ""chases and races""}, {""id"": 206715, ""name"": ""love and romance""}, {""id"": 206720, ""name"": ""teenage life""}, {""id"": 206735, ""name"": ""misfit partners""}, {""id"": 206736, ""name"": ""changing the past or future""}, {""id"": 206737, ""name"": ""getting home""}, {""id"": 206738, ""name"": ""inventions and discoveries""}]",Back to the Future,"Eighties teenager Marty McFly is accidentally sent back in time to 1955, inadvertently disrupting his parents' first meeting and attracting his mother's romantic interest. Marty must repair the damage to history by rekindling his parents' romance and - with the help of his eccentric inventor friend Doc Brown - return to 1985.",76.603233,"[{""name"": ""Universal Pictures"", ""id"": 33}, {""name"": ""Amblin Entertainment"", ""id"": 56}, {""name"": ""U-Drive Productions"", ""id"": 20448}]","[{""iso_3166_1"": ""US"", ""name"": ""United States of America""}]",1985-07-03,381109762,116.0,Back to the Future,8.0,6079,87,1985,"In this 1980s sci-fi classic, small-town California teen Marty McFly (Michael J. Fox) is thrown back into the '50s when an experiment by his eccentric scientist friend Doc Brown (Christopher Lloyd) goes awry. Traveling through time in a modified DeLorean car, Marty encounters young versions of his parents (Crispin Glover, Lea Thompson), and must make sure that they fall in love or he'll cease to exist. Even more dauntingly, Marty has to return to his own time and save the life of Doc Brown.",96,94.0,84,"250,000+",Action & Adventure,"sci fi, comedy, adventure, fantasy",$247.0K,"Michael J. Fox, Christopher Lloyd, Crispin Glover, Lea Thompson, Wendie Jo Sperber, Marc McClure, Claudia Wells, Thomas F. Wilson, James Tolkan, Casey Siemaszko, Robert Zemeckis, Kathleen Kennedy, Frank Marshall, Steven Spielberg, Bob Gale, Neil Canton, Alan Silvestri, Johnny Colla, Dean Cundey"
15000000,"[{""id"": 14, ""name"": ""Fantasy""}, {""id"": 12, ""name"": ""Adventure""}, {""id"": 16, ""name"": ""Animation""}, {""id"": 10751, ""name"": ""Family""}]",129,"[{""id"": 616, ""name"": ""witch""}, {""id"": 970, ""name"": ""parents kids relationship""}, {""id"": 2343, ""name"": ""magic""}, {""id"": 2640, ""name"": ""twilight""}, {""id"": 3762, ""name"": ""darkness""}, {""id"": 3787, ""name"": ""village and town""}, {""id"": 4652, ""name"": ""bath house""}, {""id"": 4931, ""name"": ""pig""}, {""id"": 5280, ""name"": ""ghost world""}, {""id"": 6016, ""name"": ""biology""}, {""id"": 13008, ""name"": ""train""}, {""id"": 155582, ""name"": ""amusement park""}, {""id"": 196509, ""name"": ""yokai""}, {""id"": 207695, ""name"": ""japanese mythology""}, {""id"": 210024, ""name"": ""anime""}]",千と千尋の神隠し,A ten year old girl who wanders away from her parents along a path that leads to a world ruled by strange and unusual monster-like animals. Her parents have been changed into pigs along with others inside a bathhouse full of these creatures. Will she ever see the world how it once was?,118.968562,"[{""name"": ""Studio Ghibli"", ""id"": 10342}]","[{""iso_3166_1"": ""JP"", ""name"": ""Japan""}]",2001-07-20,274925095,125.0,Spirited Away,8.3,3840,138,2001,"10-year-old Chihiro (Daveigh Chase) moves with her parents to a new home in the Japanese countryside. After taking a wrong turn down a wooded path, Chihiro and her parents discover an amusement park with a stall containing an assortment of food. To her surprise, Chihiro's parents begin eating and then transform into pigs. In this supernatural realm, Chihiro encounters a host of characters and endures labor in a bathhouse for spirits, awaiting a reunion with her parents.",97,96.0,189,"250,000+",Animation,"animation, adventure, fantasy",$10.0M,"Daveigh Chase, Suzanne Pleshette, Jason Marsden, David Ogden Stiers, Lauren Holly, Michael Chiklis, John Ratzenberger, Tara Strong, Hayao Miyazaki, Hayao Miyazaki, Kirk Wise, Donald W. Ernst, Toshio Suzuki, John Lasseter, Lori Korngiebel, Yoji Takeshige, Noboru Yoshida"
18000000,"[{""id"": 14, ""name"": ""Fantasy""}, {""id"": 18, ""name"": ""Drama""}, {""id"": 35, ""name"": ""Comedy""}, {""id"": 10749, ""name"": ""Romance""}, {""id"": 10751, ""name"": ""Family""}]",2280,"[{""id"": 1480, ""name"": ""baseball""}, {""id"": 14522, ""name"": ""co-worker""}, {""id"": 161307, ""name"": ""bronx""}, {""id"": 170710, ""name"": ""pinball machine""}, {""id"": 170711, ""name"": ""toy maker""}, {""id"": 170713, ""name"": ""duet""}, {""id"": 170715, ""name"": ""job promotion""}, {""id"": 170718, ""name"": ""homesick""}, {""id"": 170722, ""name"": ""new toy""}, {""id"": 170726, ""name"": ""quarter""}, {""id"": 170728, ""name"": ""unplugged electronic works""}, {""id"": 170729, ""name"": ""yankee stadium bronx new york city""}, {""id"": 170730, ""name"": ""walking on piano keys""}, {""id"": 170731, ""name"": ""wish fulfillment""}, {""id"": 170737, ""name"": ""bunk bed""}, {""id"": 187056, ""name"": ""woman director""}]",Big,"A young boy, Josh Baskin makes a wish at a carnival machine to be big. He wakes up the following morning to find that it has been granted and his body has grown older overnight. But he is still the same 13-year-old boy inside. Now he must learn how to cope with the unfamiliar world of grown-ups including getting a job and having his first romantic encounter with a woman. What will he find out about this strange world?",20.716023,"[{""name"": ""Gracie Films"", ""id"": 18}, {""name"": ""Twentieth Century Fox Film Corporation"", ""id"": 306}, {""name"": ""American Entertainment Partners II L.P."", ""id"": 21451}]","[{""iso_3166_1"": ""US"", ""name"": ""United States of America""}]",1988-06-03,151668774,104.0,Big,6.9,993,487,1988,"After a wish turns 12-year-old Josh Baskin (David Moscow) into a 30-year-old man (Tom Hanks), he heads to New York City and gets a low-level job at MacMillen Toy Company. A chance encounter with the owner (Robert Loggia) of the company leads to a promotion testing new toys. Soon a fellow employee, Susan Lawrence (Elizabeth Perkins), takes a romantic interest in Josh. However, the pressure of living as an adult begins to overwhelm him, and he longs to return to his simple, former life as a boy.",97,82.0,74,"250,000+",Comedy,"kids and family, comedy, fantasy",$113.5M,"Tom Hanks, Elizabeth Perkins, Robert Loggia, John Heard, Jared Rushton, David Moscow, Jon Lovitz, Mercedes Ruehl, Tracy Reiner, Penny Marshall, James L. Brooks, Robert Greenhut, Howard Shore, Barry Sonnenfeld, Barry Malkin, Paula Herold, Juliet Taylor, Santo Loquasto, Speed Hopkins"
