budget,genres,id,keywords,original_title,overview,popularity,production_companies,production_countries,release_date,revenue,runtime,title,vote_average,vote_count,Unnamed: 0,year,synopsis,critic_score,people_score,total_reviews,total_ratings,type,genre,box_office_(gross_usa),crew
255000000,"[{""id"": 28, ""name"": ""Action""}, {""id"": 12, ""name"": ""Adventure""}, {""id"": 37, ""name"": ""Western""}]",57201,"[{""id"": 1556, ""name"": ""texas""}, {""id"": 2673, ""name"": ""horse""}, {""id"": 5385, ""name"": ""survivor""}, {""id"": 5901, ""name"": ""texas ranger""}, {""id"": 9104, ""name"": ""partner""}, {""id"": 9503, ""name"": ""outlaw""}, {""id"": 10685, ""name"": ""escape""}, {""id"": 10909, ""name"": ""lawyer""}, {""id"": 13008, ""name"": ""train""}, {""id"": 178867, ""name"": ""lone ranger""}, {""id"": 179419, ""name"": ""comanche""}, {""id"": 222787, ""name"": ""the lone ranger""}, {""id"": 228232, ""name"": ""tonto""}]",The Lone Ranger,"The Texas Rangers chase down a gang of outlaws led by Butch Cavendish, but the gang ambushes the Rangers, seemingly killing them all. One survivor is found, however, by an American Indian named Tonto, who nurses him back to health. The Ranger, donning a mask and riding a white stallion named Silver, teams up with Tonto to bring the unscrupulous gang and others of that ilk to justice.",49.046956,"[{""name"": ""Walt Disney Pictures"", ""id"": 2}, {""name"": ""Jerry Bruckheimer Films"", ""id"": 130}, {""name"": ""Infinitum Nihil"", ""id"": 2691}, {""name"": ""Silver Bullet Productions (II)"", ""id"": 37380}, {""name"": ""Blind Wink Productions"", ""id"": 37381}, {""name"": ""Classic Media"", ""id"": 37382}]","[{""iso_3166_1"": ""US"", ""name"": ""United States of America""}]",2013-07-03,89289910,149.0,The Lone Ranger,5.9,2311,1600,2013,"In 1933 a boy discovers an ancient Native American in a sideshow carnival tent. The Indian is Tonto (Johnny Depp), the old companion of John Reid (Armie Hammer), a lawman more famously known as the Lone Ranger. With this opportunity to set the record straight about his and Reid's adventures, Tonto recalls the day in 1869 when he first encountered the man who would be his trusted friend and tells of their teamwork bringing down Butch Cavendish (William Fichtner) and other Old West outlaws.",30,51.0,247,"25,000+",Western,"western, adventure, action",$89.3M,"Johnny Depp, Armie Hammer, William Fichtner, Tom Wilkinson, Ruth Wilson, Helena Bonham Carter, James Badge Dale, Bryant Prince, Barry Pepper, Mason Cook, Gore Verbinski, Justin Haythe, Ted Elliott, Terry Rossio, Jerry Bruckheimer, Gore Verbinski, Mike Stenson, Chad Oman, Ted Elliott, Terry Rossio"
200000000,"[{""id"": 28, ""name"": ""Action""}, {""id"": 12, ""name"": ""Adventure""}, {""id"": 53, ""name"": ""Thriller""}]",37724,"[{""id"": 470, ""name"": ""spy""}, {""id"": 4289, ""name"": ""secret agent""}, {""id"": 9740, ""name"": ""sociopath""}, {""id"": 15127, ""name"": ""killer""}, {""id"": 15478, ""name"": ""art gallery""}, {""id"": 156095, ""name"": ""british secret service""}, {""id"": 156345, ""name"": ""istanbul turkey""}, {""id"": 156395, ""name"": ""imax""}, {""id"": 159932, ""name"": ""uzi""}, {""id"": 163841, ""name"": ""booby trap""}, {""id"": 185071, ""name"": ""impersonating a police officer""}, {""id"": 185077, ""name"": ""macao""}]",Skyfall,"When Bond's latest assignment goes gravely wrong and agents around the world are exposed, MI6 is attacked forcing M to relocate the agency. These events cause her authority and position to be challenged by Gareth Mallory, the new Chairman of the Intelligence and Security Committee. With MI6 now compromised from both inside and out, M is left with one ally she can trust: Bond. 007 takes to the shadows - aided only by field agent, Eve - following a trail to the mysterious Silva, whose lethal and hidden motives have yet to reveal themselves.",93.004993,"[{""name"": ""Columbia Pictures"", ""id"": 5}]","[{""iso_3166_1"": ""GB"", ""name"": ""United Kingdom""}, {""iso_3166_1"": ""US"", ""name"": ""United States of America""}]",2012-10-25,1108561013,143.0,Skyfall,6.9,7604,32,2012,"When James Bond's (Daniel Craig) latest assignment goes terribly wrong, it leads to a calamitous turn of events: Undercover agents around the world are exposed, and MI6 is attacked, forcing M (Judi Dench) to relocate the agency. With MI6 now compromised inside and out, M turns to the one man she can trust: Bond. Aided only by a field agent (Naomie Harris), Bond takes to the shadows and follows a trail to Silva (Javier Bardem), a man from M's past who wants to settle an old score.",92,86.0,379,"250,000+",Action & Adventure,"mystery and thriller, adventure, action",$304.4M,"Daniel Craig, Judi Dench, Javier Bardem, Ralph Fiennes, Naomie Harris, Ben Whishaw, Albert Finney, Rory Kinnear, Ola Rapace, Sam Mendes, Neal Purvis, Robert Wade, John Logan, Michael G. Wilson, Barbara Broccoli, Callum McDougall, Roger Deakins, Dennis Gassner, Stuart Baird"
250000000,"[{""id"": 28, ""name"": ""Action""}, {""id"": 12, ""name"": ""Adventure""}, {""id"": 14, ""name"": ""Fantasy""}, {""id"": 878, ""name"": ""Science Fiction""}]",127585,"[{""id"": 1228, ""name"": ""1970s""}, {""id"": 1852, ""name"": ""mutant""}, {""id"": 4379, ""name"": ""time travel""}, {""id"": 8828, ""name"": ""marvel comic""}, {""id"": 9717, ""name"": ""based on comic book""}, {""id"": 10761, ""name"": ""superhuman""}, {""id"": 14527, ""name"": ""storm""}, {""id"": 161271, ""name"": ""beast""}, {""id"": 179430, ""name"": ""aftercreditsstinger""}, {""id"": 206736, ""name"": ""changing the past or future""}]",X-Men: Days of Future Past,The ultimate X-Men ensemble fights a war for the survival of the species across two time periods as they join forces with their younger selves in an epic battle that must change the past – to save our future.,118.078691,"[{""name"": ""Twentieth Century Fox Film Corporation"", ""id"": 306}, {""name"": ""Donners' Company"", ""id"": 431}, {""name"": ""Marvel Entertainment"", ""id"": 7505}, {""name"": ""Bad Hat Harry Productions"", ""id"": 9168}, {""name"": ""TSG Entertainment"", ""id"": 22213}, {""name"": ""Down Productions"", ""id"": 37336}, {""name"": ""Revolution Sun Studios"", ""id"": 76043}]","[{""iso_3166_1"": ""GB"", ""name"": ""United Kingdom""}, {""iso_3166_1"": ""US"", ""name"": ""United States of America""}]",2014-05-15,747862775,131.0,X-Men: Days of Future Past,7.5,6032,63,2014,"Convinced that mutants pose a threat to humanity, Dr. Bolivar Trask (Peter Dinklage) develops the Sentinels, enormous robotic weapons that can detect a mutant gene and zero in on that person. In the 21st century, the Sentinels have evolved into highly efficient killing machines. With mutants now facing extinction, Wolverine (Hugh Jackman) volunteers to go back in time and rally the X-Men of the past to help change a pivotal moment in history and thereby save their future.",90,91.0,330,"250,000+",Action & Adventure,"fantasy, action, adventure, sci fi",$233.9M,"Hugh Jackman, James McAvoy, Michael Fassbender, Jennifer Lawrence, Halle Berry, Ellen Page, Peter Dinklage, Ian McKellen, Patrick Stewart, Anna Paquin, Bryan Singer, Simon Kinberg, Lauren Shuler Donner, Bryan Singer, Simon Kinberg, Hutch Parker, Stan Lee, Todd Hallowell, Josh McLaglen, John Ottman"
185000000,"[{""id"": 18, ""name"": ""Drama""}, {""id"": 28, ""name"": ""Action""}, {""id"": 80, ""name"": ""Crime""}, {""id"": 53, ""name"": ""Thriller""}]",155,"[{""id"": 849, ""name"": ""dc comics""}, {""id"": 853, ""name"": ""crime fighter""}, {""id"": 1308, ""name"": ""secret identity""}, {""id"": 3151, ""name"": ""scarecrow""}, {""id"": 4426, ""name"": ""sadism""}, {""id"": 4630, ""name"": ""chaos""}, {""id"": 6969, ""name"": ""gotham city""}, {""id"": 7002, ""name"": ""vigilante""}, {""id"": 9537, ""name"": ""joker""}, {""id"": 9715, ""name"": ""superhero""}, {""id"": 9717, ""name"": ""based on comic book""}, {""id"": 10044, ""name"": ""tragic hero""}, {""id"": 10291, ""name"": ""organized crime""}, {""id"": 18023, ""name"": ""criminal mastermind""}, {""id"": 33518, ""name"": ""district attorney""}, {""id"": 156395, ""name"": ""imax""}, {""id"": 163074, ""name"": ""super villain""}, {""id"": 163455, ""name"": ""super powers""}, {""id"": 230775, ""name"": ""batman""}]",The Dark Knight,"Batman raises the stakes in his war on crime. With the help of Lt. Jim Gordon and District Attorney Harvey Dent, Batman sets out to dismantle the remaining criminal organizations that plague the streets. The partnership proves to be effective, but they soon find themselves prey to a reign of chaos unleashed by a rising criminal mastermind known to the terrified citizens of Gotham as the Joker.",187.322927,"[{""name"": ""DC Comics"", ""id"": 429}, {""name"": ""Legendary Pictures"", ""id"": 923}, {""name"": ""Warner Bros."", ""id"": 6194}, {""name"": ""DC Entertainment"", ""id"": 9993}, {""name"": ""Syncopy"", ""id"": 9996}]","[{""iso_3166_1"": ""GB"", ""name"": ""United Kingdom""}, {""iso_3166_1"": ""US"", ""name"": ""United States of America""}]",2008-07-16,1004558444,152.0,The Dark Knight,8.2,12002,25,2008,"With the help of allies Lt. Jim Gordon (Gary Oldman) and DA Harvey Dent (Aaron Eckhart), Batman (Christian Bale) has been able to keep a tight lid on crime in Gotham City. But when a vile young criminal calling himself the Joker (Heath Ledger) suddenly throws the town into chaos, the caped Crusader begins to tread a fine line between heroism and vigilantism.",94,94.0,344,"250,000+",Action & Adventure,"fantasy, action, adventure",$2.0M,"Christian Bale, Heath Ledger, Aaron Eckhart, Michael Caine, Maggie Gyllenhaal, Gary Oldman, Morgan Freeman, Ron Dean, Cillian Murphy, Christopher Nolan, Jonathan Nolan, Christopher Nolan, Emma Thomas, Charles Roven, Christopher Nolan, Kevin De La Noy, Benjamin Melniker, Michael E. Uslan, Thomas Tull"
140000000,"[{""id"": 28, ""name"": ""Action""}, {""id"": 878, ""name"": ""Science Fiction""}, {""id"": 12, ""name"": ""Adventure""}]",1726,"[{""id"": 539, ""name"": ""middle east""}, {""id"": 6163, ""name"": ""arms dealer""}, {""id"": 8613, ""name"": ""malibu""}, {""id"": 8828, ""name"": ""marvel comic""}, {""id"": 9715, ""name"": ""superhero""}, {""id"": 9717, ""name"": ""based on comic book""}, {""id"": 12555, ""name"": ""tony stark""}, {""id"": 173776, ""name"": ""iron man""}, {""id"": 179430, ""name"": ""aftercreditsstinger""}, {""id"": 180547, ""name"": ""marvel cinematic universe""}, {""id"": 208630, ""name"": ""counter terrorism""}, {""id"": 209756, ""name"": ""agent coulson""}]",Iron Man,"After being held captive in an Afghan cave, billionaire engineer Tony Stark creates a unique weaponized suit of armor to fight evil.",120.725053,"[{""name"": ""Marvel Studios"", ""id"": 420}]","[{""iso_3166_1"": ""US"", ""name"": ""United States of America""}]",2008-04-30,585174222,126.0,Iron Man,7.4,8776,50,2008,"A billionaire industrialist and genius inventor, Tony Stark (Robert Downey Jr.), is conducting weapons tests overseas, but terrorists kidnap him to force him to build a devastating weapon. Instead, he builds an armored suit and upends his captors. Returning to America, Stark refines the suit and uses it to combat crime and terrorism.",94,91.0,280,"250,000+",Action & Adventure,"sci fi, adventure, action, fantasy",$318.3M,"Robert Downey Jr., Terrence Howard, Gwyneth Paltrow, Jeff Bridges, Shaun Toub, Faran Tahir, Leslie Bibb, Sayed Badreya, Clark Gregg, Bill Smitrovich, Jon Favreau, Mark Fergus, Hawk Ostby, Art Marcum, Matt Holloway, Avi Arad, Kevin Feige, Louis D'Esposito, Peter Billingsley, Jon Favreau"
170000000,"[{""id"": 12, ""name"": ""Adventure""}, {""id"": 18, ""name"": ""Drama""}, {""id"": 10751, ""name"": ""Family""}]",44826,"[{""id"": 295, ""name"": ""library""}, {""id"": 1507, ""name"": ""clock""}, {""id"": 2793, ""name"": ""film director""}, {""id"": 2849, ""name"": ""key""}, {""id"": 4290, ""name"": ""toy""}, {""id"": 5202, ""name"": ""boy""}, {""id"": 9673, ""name"": ""love""}, {""id"": 13014, ""name"": ""orphan""}, {""id"": 14544, ""name"": ""robot""}, {""id"": 14545, ""name"": ""automaton""}, {""id"": 18028, ""name"": ""hiding""}, {""id"": 33490, ""name"": ""filmmaking""}, {""id"": 41372, ""name"": ""leg brace""}, {""id"": 156149, ""name"": ""doberman""}, {""id"": 209714, ""name"": ""3d""}]",Hugo,"Hugo is an orphan boy living in the walls of a train station in 1930s Paris. He learned to fix clocks and other gadgets from his father and uncle which he puts to use keeping the train station clocks running. The only thing that he has left that connects him to his dead father is an automaton (mechanical man) that doesn't work without a special key which Hugo needs to find to unlock the secret he believes it contains. On his adventures, he meets with a shopkeeper, George Melies, who works in the train station and his adventure-seeking god-daughter. Hugo finds that they have a surprising connection to his father and the automaton, and he discovers it unlocks some memories the old man has buried inside regarding his past.",32.319043,"[{""name"": ""Paramount Pictures"", ""id"": 4}, {""name"": ""Infinitum Nihil"", ""id"": 2691}, {""name"": ""GK Films"", ""id"": 3281}]","[{""iso_3166_1"": ""FR"", ""name"": ""France""}, {""iso_3166_1"": ""US"", ""name"": ""United States of America""}, {""iso_3166_1"": ""GB"", ""name"": ""United Kingdom""}]",2011-11-22,185770160,126.0,Hugo,7.0,2141,852,2011,"Orphaned and alone except for an uncle, Hugo Cabret (Asa Butterfield) lives in the walls of a train station in 1930s Paris. Hugo's job is to oil and maintain the station's clocks, but to him, his more important task is to protect a broken automaton and notebook left to him by his late father (Jude Law). Accompanied by the goddaughter (Chloë Grace Moretz) of an embittered toy merchant (Ben Kingsley), Hugo embarks on a quest to solve the mystery of the automaton and find a place he can call home.",93,78.0,228,"50,000+",Kids & Family,"drama, adventure, fantasy",$73.8M,"Ben Kingsley, Sacha Baron Cohen, Asa Butterfield, Chloë Grace Moretz, Ray Winstone, Emily Mortimer, Christopher Lee, Helen McCrory, Michael Stuhlbarg, Frances de la Tour, Martin Scorsese, John Logan, Graham King, Tim Headington, Martin Scorsese, Johnny Depp, Emma Tillinger Koskoff, David Crockett, Georgia Kacandes, Christi Dembrowski"
170000000,"[{""id"": 28, ""name"": ""Action""}, {""id"": 12, ""name"": ""Adventure""}, {""id"": 35, ""name"": ""Comedy""}, {""id"": 878, ""name"": ""Science Fiction""}, {""id"": 37, ""name"": ""Western""}]",8487,"[{""id"": 10028, ""name"": ""steampunk""}, {""id"": 10988, ""name"": ""based on tv series""}, {""id"": 163671, ""name"": ""steam locomotive""}, {""id"": 171636, ""name"": ""drag""}]",Wild Wild West,Legless Southern inventor Dr. Arliss Loveless plans to rekindle the Civil War by assassinating President U.S. Grant. Only two men can stop him: gunfighter James West and master-of-disguise and inventor Artemus Gordon. The two must team up to thwart Loveless' plans.,40.748915,"[{""name"": ""Todman, Simon, LeMasters Productions"", ""id"": 2507}, {""name"": ""Warner Bros."", ""id"": 6194}, {""name"": ""Peters Entertainment"", ""id"": 16774}, {""name"": ""Sonnenfeld Josephson Worldwide Entertainment"", ""id"": 57088}]","[{""iso_3166_1"": ""US"", ""name"": ""United States of America""}]",1999-06-29,222104681,106.0,Wild Wild West,5.1,1020,1604,1999,"When President Ulysses S. Grant (Kevin Kline) learns that diabolical inventor Dr. Arliss Loveless (Kenneth Branagh) is planning to assassinate him, he orders Civil War hero James West (Will Smith) and U.S. Marshal Artemus Gordon (also Kline) to arrest him. West's trigger-happy personality doesn't always mesh well with that of the thoughtful Gordon, but they manage to work together. And with the help of a mysterious stranger (Salma Hayek), West and Gordon close in on Loveless.",17,28.0,131,"250,000+",Western,"comedy, western, action",$113.8M,"Will Smith, Kevin Kline, Kenneth Branagh, Salma Hayek, Ted Levine, M. Emmet Walsh, Bai Ling, Rodney A. Grant, Garcelle Beauvais, Musetta Vander, Barry Sonnenfeld, Jim Thomas, John Thomas, S.S. Wilson, Brent Maddock, Jeffrey Price, Peter S. Seaman, Barry Josephson, Tracy Glaser, Kim LeMasters"
178000000,"[{""id"": 28, ""name"": ""Action""}, {""id"": 878, ""name"": ""Science Fiction""}]",137113,"[{""id"": 563, ""name"": ""deja vu""}, {""id"": 1521, ""name"": ""time warp""}, {""id"": 2062, ""name"": ""restart""}, {""id"": 4565, ""name"": ""dystopia""}, {""id"": 6091, ""name"": ""war""}, {""id"": 9951, ""name"": ""alien""}, {""id"": 11109, ""name"": ""military officer""}, {""id"": 13065, ""name"": ""soldier""}, {""id"": 14909, ""name"": ""alien invasion""}, {""id"": 204318, ""name"": ""exoskeleton""}]",Edge of Tomorrow,"Major Bill Cage is an officer who has never seen a day of combat when he is unceremoniously demoted and dropped into combat. Cage is killed within minutes, managing to take an alpha alien down with him. He awakens back at the beginning of the same day and is forced to fight and die again... and again - as physical contact with the alien has thrown him into a time loop.",79.456485,"[{""name"": ""Village Roadshow Pictures"", ""id"": 79}, {""name"": ""Warner Bros."", ""id"": 6194}, {""name"": ""Viz Media"", ""id"": 6687}, {""name"": ""Province of British Columbia Production Services Tax Credit"", ""id"": 12200}, {""name"": ""3 Arts Entertainment"", ""id"": 36390}, {""name"": ""RatPac-Dune Entertainment"", ""id"": 41624}]","[{""iso_3166_1"": ""AU"", ""name"": ""Australia""}, {""iso_3166_1"": ""US"", ""name"": ""United States of America""}]",2014-05-27,370541256,113.0,Edge of Tomorrow,7.6,4858,1252,2014,"When Earth falls under attack from invincible aliens, no military unit in the world is able to beat them. Maj. William Cage (Tom Cruise), an officer who has never seen combat, is assigned to a suicide mission. Killed within moments, Cage finds himself thrown into a time loop, in which he relives the same brutal fight -- and his death -- over and over again. However, Cage's fighting skills improve with each encore, bringing him and a comrade (Emily Blunt) ever closer to defeating the aliens.",91,90.0,326,"100,000+",Science Fiction & Fantasy,"sci fi, action",$100.2M,"Tom Cruise, Emily Blunt, Brendan Gleeson, Bill Paxton, Jonas Armstrong, Tony Way, Kick Gurry, Franz Drameh, Dragomir Mrsic, Charlotte Riley, Doug Liman, Christopher McQuarrie, Jez Butterworth, John-Henry Butterworth, Erwin Stoff, Tom Lassally, Jason Hoffs, Gregory Jacobs, Jeffrey Silver, Doug Liman"
170000000,"[{""id"": 878, ""name"": ""Science Fiction""}, {""id"": 28, ""name"": ""Action""}, {""id"": 18, ""name"": ""Drama""}, {""id"": 53, ""name"": ""Thriller""}]",119450,"[{""id"": 3077, ""name"": ""leader""}, {""id"": 4090, ""name"": ""colony""}, {""id"": 4458, ""name"": ""post-apocalyptic""}, {""id"": 4565, ""name"": ""dystopia""}, {""id"": 5774, ""name"": ""forest""}, {""id"": 9663, ""name"": ""sequel""}, {""id"": 9720, ""name"": ""woods""}, {""id"": 14759, ""name"": ""ape""}, {""id"": 14760, ""name"": ""scientist""}, {""id"": 15149, ""name"": ""monkey""}, {""id"": 158025, ""name"": ""medical research""}, {""id"": 158130, ""name"": ""animal attack""}, {""id"": 188959, ""name"": ""plague""}, {""id"": 209714, ""name"": ""3d""}]",Dawn of the Planet of the Apes,"A group of scientists in San Francisco struggle to stay alive in the aftermath of a plague that is wiping out humanity, while Caesar tries to maintain dominance over his community of intelligent apes.",243.791743,"[{""name"": ""Ingenious Media"", ""id"": 290}, {""name"": ""Chernin Entertainment"", ""id"": 7076}, {""name"": ""TSG Entertainment"", ""id"": 22213}]","[{""iso_3166_1"": ""US"", ""name"": ""United States of America""}]",2014-06-26,710644566,130.0,Dawn of the Planet of the Apes,7.3,4410,77,2014,"Ten years after simian flu wiped out much of the world's homosapiens, genetically enhanced chimpanzee Caesar (Andy Serkis) and his ever-growing band of followers have established a thriving colony just outside San Francisco in Muir Woods. Meanwhile, a small band of human survivors emerges, which forces Caesar -- as leader -- to grapple with the dual challenge of protecting his people and re-establishing a relationship with the remaining human population -- the latter being Caesar's secret wish.",90,88.0,315,"100,000+",Action & Adventure,"action, adventure, sci fi",$208.5M,"Andy Serkis, Jason Clarke, Gary Oldman, Keri Russell, Toby Kebbell, Kodi Smit-McPhee, Kirk Acevedo, Jon Eyez, Enrique Murciano, Terry Notary, Matt Reeves, Rick Jaffa, Amanda Silver, Mark Bomback, Peter Chernin, Dylan Clark, Rick Jaffa, Amanda Silver, Thomas M. Hammel, Mark Bomback"
165000000,"[{""id"": 12, ""name"": ""Adventure""}, {""id"": 10751, ""name"": ""Family""}, {""id"": 16, ""name"": ""Animation""}, {""id"": 28, ""name"": ""Action""}, {""id"": 35, ""name"": ""Comedy""}]",177572,"[{""id"": 380, ""name"": ""brother brother relationship""}, {""id"": 1701, ""name"": ""hero""}, {""id"": 2276, ""name"": ""talent""}, {""id"": 9748, ""name"": ""revenge""}, {""id"": 12392, ""name"": ""best friend""}, {""id"": 12446, ""name"": ""another dimension""}, {""id"": 14544, ""name"": ""robot""}, {""id"": 33353, ""name"": ""boy genius""}, {""id"": 41509, ""name"": ""hate""}, {""id"": 179430, ""name"": ""aftercreditsstinger""}, {""id"": 198423, ""name"": ""moral dilemma""}, {""id"": 209714, ""name"": ""3d""}, {""id"": 213104, ""name"": ""teen superheroes""}, {""id"": 215235, ""name"": ""dead brother""}]",Big Hero 6,"The special bond that develops between plus-sized inflatable robot Baymax, and prodigy Hiro Hamada, who team up with a group of friends to form a band of high-tech heroes.",203.73459,"[{""name"": ""Walt Disney Pictures"", ""id"": 2}, {""name"": ""Walt Disney Animation Studios"", ""id"": 6125}]","[{""iso_3166_1"": ""US"", ""name"": ""United States of America""}]",2014-10-24,652105443,102.0,Big Hero 6,7.8,6135,167,2014,"Robotics prodigy Hiro (Ryan Potter) lives in the city of San Fransokyo. Next to his older brother, Tadashi, Hiro's closest companion is Baymax (Scott Adsit), a robot whose sole purpose is to take care of people. When a devastating turn of events throws Hiro into the middle of a dangerous plot, he transforms Baymax and his other friends, Go Go Tamago (Jamie Chung), Wasabi (Damon Wayans Jr.), Honey Lemon (Genesis Rodriguez) and Fred (T.J. Miller) into a band of high-tech heroes.",89,91.0,226,"100,000+",Animation,"comedy, animation, sci fi, action, kids and family, adventure",$222.5M,"Ryan Potter, Scott Adsit, T.J. Miller, Jamie Chung, Damon Wayans Jr., Genesis Rodriguez, Daniel Henney, Maya Rudolph, James Cromwell, Alan Tudyk, Don Hall, Roy Conli, Robert L. Baird, Daniel Gerson, Henry Jackman, Rob Dressel, Jamie Sparer Roberts"
165000000,"[{""id"": 14, ""name"": ""Fantasy""}, {""id"": 12, ""name"": ""Adventure""}, {""id"": 16, ""name"": ""Animation""}, {""id"": 10751, ""name"": ""Family""}]",10191,"[{""id"": 334, ""name"": ""flying""}, {""id"": 1318, ""name"": ""blacksmith""}, {""id"": 1395, ""name"": ""arena""}, {""id"": 2041, ""name"": ""island""}, {""id"": 3752, ""name"": ""night""}, {""id"": 3799, ""name"": ""ship""}, {""id"": 4613, ""name"": ""training""}, {""id"": 5331, ""name"": ""village""}, {""id"": 5774, ""name"": ""forest""}, {""id"": 5895, ""name"": ""viking""}, {""id"": 6054, ""name"": ""friendship""}, {""id"": 6253, ""name"": ""ignorance""}, {""id"": 8044, ""name"": ""flight""}, {""id"": 9109, ""name"": ""nest""}, {""id"": 12554, ""name"": ""dragon""}, {""id"": 14643, ""name"": ""battle""}, {""id"": 18543, ""name"": ""combat""}, {""id"": 172784, ""name"": ""well""}, {""id"": 192913, ""name"": ""warrior""}]",How to Train Your Dragon,"As the son of a Viking leader on the cusp of manhood, shy Hiccup Horrendous Haddock III faces a rite of passage: he must kill a dragon to prove his warrior mettle. But after downing a feared dragon, he realizes that he no longer wants to destroy it, and instead befriends the beast – which he names Toothless – much to the chagrin of his warrior father",67.263269,"[{""name"": ""DreamWorks Animation"", ""id"": 521}, {""name"": ""Vertigo Entertainment"", ""id"": 829}, {""name"": ""Mad Hatter Entertainment"", ""id"": 20154}]","[{""iso_3166_1"": ""US"", ""name"": ""United States of America""}]",2010-03-05,494878759,98.0,How to Train Your Dragon,7.5,4227,119,2010,"Hiccup (Jay Baruchel) is a Norse teenager from the island of Berk, where fighting dragons is a way of life. His progressive views and weird sense of humor make him a misfit, despite the fact that his father (Gerard Butler) is chief of the clan. Tossed into dragon-fighting school, he endeavors to prove himself as a true Viking, but when he befriends an injured dragon he names Toothless, he has the chance to plot a new course for his people's future.",99,91.0,211,"250,000+",Animation,"comedy, fantasy, animation, kids and family, adventure",$217.4M,"Jay Baruchel, Gerard Butler, America Ferrera, Jonah Hill, Christopher Mintz-Plasse, Craig Ferguson, Kristen Wiig, T.J. Miller, Chris Sanders, Dean DeBlois, Chris Sanders, Dean DeBlois, Bonnie Arnold, Kristine Belson, Kathy Altieri, Darren Holmes"
